en,om
"KUTU was formed as a result of a meeting in Addis Ababa between French violinist Théo Ceddaldi and Ethiopian new age singers Hewan Gebrewold and Haleluya Tekletsadik with band members Valentin Ceccaldi on bass, Akemi Fujimori on keyboards and Cyril Atef o","Nahuu LLC'n Keeniyaa sagantaa yaalii chaanaalii bashannanaa Itoopiyaa isaa, Nahoo TV, kampanii naannoo Tuubaa Multimiidiyaa wajjin tahuun akka eegale beeksise."
"In a presser he gave today, Deputy Commissioner Damene Darota said that some parts of Amhara, Oromiya, SNNP and Tigray as well as most parts of Gambella regional states are vulnerable to flash flood.","Ibsa har'a kenneen, Itti aanaan Koominerii Daammenee Daarotaa kutaalee Amaaraa, Oromiyaa, SNNP fi Tigraay muraasi akkasumas kutaalee mootummaan naannoo Gambeelaa lolaaf saaxilamoo akka taha dubbate."
"More than 500,000 USD has been allocated from the United Nations Central Emergency Response Fund (CERF) towards supporting the preventive measles campaign, it was learned.","Duula ittisa miizilii deggeruuf Fandii Giddugaleessa Deebii Tasaa Motummoota Gamtoomanii irraa USD 500,000 ol akka ramadame, hubatame."
"The Addis Ababa Water and Sewerage Autority (AAWSA) has hired a contractor to relocate the pipeline by April 2013, according to ERC’s deputy CEO, Debo.","Akka ittaanaa CEO ERC, Debo'tti, Abbaan Taayitaa Bishaanii fi Dhangala'aa Addis Ababaa (AAWSA) bara 2013tti ujummootti bakka jijjjiiruuf kontiraaktera qaxare."
"It is to be recalled that, in October 2017, Prime Minister Hailemariam Dessalegn, in his address to the House of Peoples’ Representatives (HPR), said that his administration has accepted the resignation of Bereket.","Akkuma yaadatamu, Onkoleelessa 2017, Ministeerri Muummee Hayilemaariyaam Dessaaleny, mana maree bakka bu'oota ummataa(MBU) bakka bu'uun, bulchiinsi isaanii fedhaan aangoo gadlakkisuu Barakat fudhateera."
Scientists confirm a second detection of gravitational waves by LIGO.,Saayintistoonni dambaliin harkisa dachee yeroo lammataaf LIGO dhaan adda bahuu isaa mirkaneessan.
An Australian internal review finds that the fatal Christmas Island boat disaster was responded to appropriately.,Gulaalliin keessoo Awustiraaliyaa balaa hamaa bidiruu Odola Kiristimaasiif haalaan deebiin gahaan akka kennemeef mul'ise.
Ethiopia’s health care service has been proved successful in not only by making primary health care service accessible but also by improving quality of service from time to time.,Tajaajilli kunuunsa fayyaa Itoophiyaa tajaajila kunuunsa fayyaa sadarkaa duraa ijaaruu qofa osoo taane qulqullina tajaajil foyyeessuudhaanis milkaa'uu isaa mirkaneesseera.
"“Hurting the wider business community just to cripple few illegal money operators is not fair. Of course, weakening the parallel market is a step in the right direction but adopting a radical measure will cause more problems,” said Wujrayib Yibgeta, Vice President of Addis Ababa Traders Forum.","""Hojjeettoota maallaqaa seeran alaa muraasa naafessuuf hawaasa daldalaa bal'aa miidhuun haqa-qabeeessa miti. Dhuguma, daldala gabaa gurraachaa dadhabsiisuun tarkaanfii gara sirriitti garuu tarkaanfii fiinxalaa madaqsuun rakkoo dabalataa fida"", Itti aanaa Pirexidaantiin Foramii Daldaltoota Finfinnee Wujraayib Yibgeetaa jedheera."
"State-owned gas company, Gazprom, loses 86 percent in net income due to ruble devaluation, plunge on oil prices, and Ukraine crisis.","Dhaabbanni boba'aa mootummaa, Gaazpiroom, sababa gadi bu'uu gatii raabili, kufuu gatii boba'aa, fi rakkoo Yukiriyeen keessaan galii harka gahu irratti dhibbantaa 86 dhabe."
Archbishop of York Dr. John Sentamu calls on the Church of England not to permit same-sex marriage.,Hangafni phaaphaasii Yoork Dr. Joon Seentamun manni kiristaanaa Ingilaand gaa'ila saala wal fakkaataa akka hin eyyemneef waamicha taasisan.
The International Monetary Fund (IMF) approved last month a program for Ethiopia of 2.9 billion US dollars.,Fandiin Maallaqaa Adunyaa( IMF) Itoophiyaadhaaf sagantaa dolaara Ameerikaa biliyoona 2.9 ji'a darbe mirkaneesse.
Sky News reports new evidence that North Korean officials have been involved in the illegal drugs trade.,Iskaay Niwus ragaa haaraa kan angawoonni Kooriyaa Kaabaa daldala qorichoota seeraan alaa keessatti hirmaatan gabaase.
"Ali Akbar Salehi, former Iranian foreign minister, is appointed as head of Atomic Energy Organization of Iran.","Alii Akbaar Saalee, ministeerri haajaa alaa Iraan duraanii, geggeessaa Dhabbata Annisaa Atoomawaa Iraan tahee muudame."
The Federal Communications Commission approves Google's plan to restore some cell phone service in hurricane-hit Puerto Rico with Project Loon balloons.,Koomishiniin koomunikeeshinii Federaalaa karoora Googiliin naannoolee Puwertoo Riikoo obombolettiin rukutamaniif pirojektii afuuffee Looniin bilbiloota socha'aa bakka deebisuuf jedhuuf eeyyama kenne.
The Trump administration plans to increase the budget of the United States Armed Forces by more than 9%.,Bulchiinsi Tiraamp bajata humna hidhannoo waraanaa Yunaaytid Isteetis 9%n oliin dabaluuf karoorsee jira.
"The research of the Ethiopian award-winning researcher, Dr. Martha Zewdie was on regulatory T cells in pulmonary tuberculosis patients.","Qorannoon, qorattuu badhaasa mo'attuu lammii Itoopiyaa, Dr. Maartaa Zewudee to'annoo seeliiwwan T dhukkubsattoota pulmonarii tiyuuberkiloosis irrattidha."
"For instance, Chencha, Dita, Gacho Baba and Bonki are some of the mountainous areas where the farming is taking place.","Fakkeenyaaf, Cancaa, Ditaa, Gaaccoo Baabaa fi Boonkiin bakkeewwn gaarawoo iddoo qotiisni itti raawwatu muraasa."
The death toll from Typhoon Megi in the Philippines rises to three as heavy rain falls on the island of Luzon for a second consecutive day.,Roobni hamaan Odola Luuzaaan irratti guyyoota walitti aanan lamaaf osoo roobuu Filippiins keessatti lakkoofsa namoota obomboleetti Megiitiin lubbuun isaanii darbee gara sadiitti guddate.
"The set included multilingual music from within Ethiopia, incorporating love songs, breakup anthems and folk songs in different languages.","Qindoominichi kan hammatu muuziqaa afaan garagaraa Itoopiyaa keessaa, faaruuwwan jaalalaa, faaruu adda bahuu fi faaruuwwan maatii afaan garagaraan hammata."
"As COVID-19 in Ethiopia has been consistently on the rise and triggering calls for more robust measures to halt the spread of the virus, the government is taking various measures to prevent the spread of the pandemic, it was indicated.","Akkuma COVID-19'n Itoopiyaa keessaa walitti fufiinsaan dabalaa deemuun tarkaanfii cimaa babal'ina vaayirichaa hir'isu gochuuf kakaasaa jiru, mootummaan tarkaanfilee adda addaa babal'ina weerarichaa hambisu fudhachaa jira, jedhamee ibsame."
"In golf, the final round of The Open Championship is played at the Old Course at St Andrews in Scotland with Zach Johnson winning a four hole playoff with Marc Leishman and Louis Oosthuizen. ,","Goolfii keessatti, marsaan xumuraa Dorgommii Ooppen Oold Koorsii Qulqulluu Andiruukan Iskootilaand keessaatti Zaak Joonsan, Maark Leyishmaanii fi Luwis Oostuuzeen wajjin tapha dabalataa boolla afurii injifachuun taphatame."
An inquest into the death of nurse Jacintha Saldanha hears that she died as a result of self-inflicted hanging.,Bu'aan qorannoo waa'ee du'aatii ogeettii fayyaa Zaakintaa Saldaanihaa akka agarsiisutti sababa du'a ishee of fanniistee ta'uunisaa dubbatame.
The deal includes helping the landlocked nation build a navy.,Waliigaltichi biyyi daangaa lafaatin marfamte akka humna waraana bishaanirraa akka ijaartuu deeggaru ni hammata.
NASA’s Curiosity rover finds calcium deposits on Mars similar to those seen on Earth when water circulates in cracks and rock fractures.,Kiwuriyoosiitii roveriin NASA ruqa kaalsiyeemii lafa irratti yeroo bishaan fi kattaan caccabu waliin wal fakkaatu maarsii irratti argateera.
At least seven people are killed and 30 trapped after a pile of waste collapses in a Coal India mine in Jharkhand.,Caccabuu kosii bakka albuuda Dhagaa Cilee Hindii Jaarkihaand keessatti mudate booda yoo xiqqaate namoonni torba du'uun 30'ni ammoo jalatti qabaman.
An experimental vaccine for dengue fever has been developed in Manila.,Maanillaa keessatti dhukkuba ho'ina qaamaa Daangiitiif vaaksiiniin Haaraan qopha'eera.
"For many, Ababa Tesfaye was a father figure, a teacher, an educator, an entertainer and a patron of good will in society, writes Samuel Getachew.","Baayyeedhaaf, Abbaabbaa Tasfaaayeen fakeenya abbaa, barsiisaa, hubachiisaa, bashanansiisaa fi hawaasa keessatti deeggara hojii gaariiti, Samu'el Getachew'tu barreesse."
Four buildings are evacuated on the Harvard University campus after unconfirmed claims that bombs were planted in them.,Mooraa yuniversitii Haarvaard keessattii odeeffanoo hin markanoofne boombiin awwaalameera jedhu erga dhaga'ameen booda gamoolee afur keessaa akka namni yaa'u taasifame.
"Trace Tv is a global afro-urban entertainment channel to connect and empower the new generation and it is experiencing rapid international expansion, with different feeds present in 60 countries.",Tv'n Tirees chaanaalii bashannanaa addunyaawaa ummata afrikaa magaalaa jiraatanii dhaloota haaraa wal quunnamsiisuu fi kakaasuuf tahe qophiilee garagaraa biyyoota 60 keessatti agarsiisuun babal'ina addunyawaa ariifataa tahe agarsiisaa jira
"According to the PM, the latest offer is issued for the first time to the private sector to get involved in the power production sector.","Akk PM'chi jedhanitti, afeerraan inni boodana godhame sekterri dhuunfaa yeroo jalqabaaf sektera oomisha humna ibsaa keessatti akka hirmaatan gochuufidha."
"But, for the millennials of Addis, it is far more than simple grooming.","Garuu, kumoota Finfinnee keessa jiraniif, uffanaa salphaadhaa oli."
Czech Republic goalkeeper Petr Čech drops a clanger in his country's game against 2004 champions Greece in a match that had the fewest shots in the European Championship since 1980.,"Goolii eegaan Cheek Rippaabiliik,Piiter Cheek dorgommiin erga bara 1980 as Shaampiyoonshippii Awurooppaa keessatti marsaa muraasa qofa dorgomame biyyi isaa shaampiyoona bara 2014ii Greek waliin goote irraatti dogoggora hamaa raawwate."
This was disclosed at a three-day training held this week in Addis Ababa on chemical weapons control and chemical safety and security management facilitated by Organization for Prevention of Chemical Weapons (OPCW) for member states.,Kun leenjii guyyaa sadii Addis Ababaa keessatti to'annoo meeshaalee waraanaa keemikaalaa fi bulchiinsa nageenya keemikaalaa Dhaabbati Ittisa Meeshaalee Waraanaa Keemikaalaa (OPCW) biyyoota miseensotaaf kenne irratti ifoome.
"Ministry’s Malaria Programs Officer, Dereje Dilu, told Walta Information Center that over 916,000 kilograms of anti malaria chemicals and spraying materials have been distributed in 160 malaria prone Woredas of the country.","Ogeessi Sagantaa Malaariyaa Ministeerichaa, Darajjee Diluu, keemikaalotnni farra malaariyaa kiilogiraama 916,000 ol tahuu fi meeshaaleen ittin biifan Aaanaalee 160 biyyattii kanneen malaariyaan hubamuu malaniif akka raabsame Giddugala Odeeffannoo Waaltaatti hime."
The Commonwealth Games Federation demands that India improve conditions at the athletes' village in Delhi.,Federeeshiniin taphoota koman weelz Indiyaan haalota ganda Atileetiksii Deelhii keessa jiran akka fooyyeessituuf gaafate.
"According to the organizers, the winners will be awarded with a prize.","Akka qindeessitootaatti, injifattootni ni badhaafamu."
"From the stand out fixtures, Fasil City will host Ethiopia Coffee while Welwalo Adigrat faces Hadiya Hosana and St. George play against Dire Dawa City.","Warreen eegaman keessaa, Adigiraat Hadiyyaa Hosaanaa yeroo qunnamuu fi Qulqulluu Gorgis Magaalaa Diree Dawaa waliin taphatu Magaalaan Faasil Buna Itoophiyaa ni keessummeessa."
"A new species of ancient crocodile, Khoratosuchus jintasakuli, is identified from a fossil in Thailand.",Sanyii haaraa Naacha durii kan ta'e 'koratosukus jintasukali' jedhamu hamba lafee durii Taayilaand keessatti argameerraa adda baafame.
"Delta Air Lines says that it expects sharp fuel cost increases in 2011, perhaps to $2.60 a gallon from $2.47 last year.","Daandiin qilleensaa Deltaa bara 2011 keessa olka'iinsa qajeelloo gatii boba'aa akka jiraatu nii eega, tarii kan bara darbee barmelii tokkotti $2.47 irraa gara $2.60 tti."
"In his new work entitled ""The Massacre of Debre Libanos Ethiopia 1937; the Story of One of Fascism’s Shocking Atrocities"", the author yet again presents the events surrounding both the assassination attempt in Addis Ababa, Ethiopia on 19 February 1937, and the reprisal killings and massacre that occurred in the days and months that followed.","Hojii isaa haaraa ""Ajjeechaa jumlaa Debire Libaanos Itoopiyaa 1937; seenaa hammeenya Faashistii Nama Naasisu keessaa tokko"" jedhamee waamamu keessatti, barreessichi ammas irra deebiin taateewwan yaalii ajjeechaa 19 Guraandhala 1937 Addis Ababaa, Itoopiyaa keessaa, fi ajjeechaawwanii fi ajjeechaa jumlaa ija bahumsaa isa guyyootaa fi ji'oota itti aananii dhufan keessatti tahe dhiyeessa."
California Governor Jerry Brown declares a drought emergency and asks residents of the state to voluntarily conserve water.,Bulchaan Kaaliforniyaa Jeerii Biraawon balaa hongee labsuun jiraattonni naannichaa akka fedhiidhaan bishaan kunuunsan gaafatan.
"Safaricom Ethiopia delegation provided updates on its operations in the country, it was learned.","Jilli Safarikom Itoophiyaa biyyatti keessatti hojiilee isaa irratti foyya'iinsa akka dhiyeesse, hubatameera."
"Vitali Klitschko defeats Odlanier Solís via a controversial first-round technical knockout to retain the WBC Heavyweight Championship in Cologne, Germany.",Vitaali Kilichkoon dorgommii badhaasa bunyaa ulfaatina guddaa WPC Germanii Kiloony keessattii geggeeffamnerratti badhaasicha hambifachuuf Oodlaner Solisiiniin marsaa duraatiin rukuttaa haqummaan isaa falmisiisaa ta'een mo'ate.
The Minister said Ethiopia has introduced cadastral-based modern mining licensing and database system to promote investments in the sector.,Ministeerichi Itoophiyaan sirna eeyyama kennuu fi daataabeezii ammayyaa kadastiraala irratti hundaa'e sektara investimentii ceesisuuf beeksisteetti jedhaniruu.
Ethiopia has planted 20 billion trees to build a climate-resilient green economy and assist the Global efforts to respond to the Earth’s climate change and its adverse effects.,Itoopiyaan diinagdee magariisa jijjiirama qilleensaa damdamatu ijaaruu fi tattaafffi addunyaa jijjiirama qilleensaa Dachee fi miidhaalee inni fiduu danda'uuf deebii kennuu gargaaruuf biqiltuu mukaa biliyoona 20 dhaabde.
"The Nobel Committee awarded the prize for Abiy for his efforts to achieve peace and international cooperation, particularly for his decisive initiative to resolve the border conflict with neighboring Eritrea last year, three months after he came to power in April 2018.","Ministeerri Bishaanii fi Jallisii Itoopiyaa Siileshii Baqqalee, Ministeerri Qabeenya Bishaanii fi Jallisii Sudaan Mu'aataaz Muusaa; fi Ministeerri Qabeenya Bishaanii fi Jallisii Gibxii Mohaammed Abdel Atii walgahicha hirmaachaa turan."
The government hopes that cleaning up informal mining by channeling gold sales through the central bank is a first step to making the country more attractive to investors.,Mootummaan albuuda baasuu seera-qabeessa hin taane gurgurtaa warqee gama baankii giddu galeessatiin gochuun qulqulleessuun biyyatti investarootaaf hawwattu gpchuuf tarkaanfii jalqabaati jechuun ni abdata.
"Vietnamese banking tycoon Nguyen Duc Kien is sentenced to 30 years in prison in Vietnam on charges of tax evasion, violating state economic regulations, fraud, and running an illegal business.","Abbaan qabeenyaa Baankii Niguyeen Dak keeyin yakkoota akka gibira seeraan kaffalu dhabuu,seerota diinagdee biyyattii cabsuu fi daldala seeraan alaa raawwachuu isaatiin adabbii hidhaa wagga 30 tiin Veetinaam keessatti hidhame."
"A magnitude 6.0 earthquake strikes the western Iranian province of Kermanshah, killing at least two people and injuring more than 200 others.",Bulchiinsa biyya lixa Iraan kutaa biyya Kermaanshah keessatti kirkira lafaa hammeentaa 6.0 mudateen yoo xiqqaate namoonni lama yoo du'an namoonni 200 ammoo miidhamaniiru.
"Excluding skin cancer, 50% of the 10 Million people diagnosed with cancer annually live in developing countries.","Kaanserii gogaa hambsiu, 50% ummata miliyoona 10 waggaatti kaanseriif qoratamanii biyyoota guddataa jiran keessa jiraatu."
"But, they explain each of the skaters have their own signature moves and marks with which they can be identified.","Garuu, sigigaattootni tokkoon tokkoon isaanii mallattoo sochii fi mallattoo ittiin adda ba'an akka qaban ibsaniiru."
"Belgium officials lower the official death toll from 35 to 32, with nearly 100 still hospitalized.","Aangawoonni Beeljiyeem hamma namoota du'anii ifaan 35 irraa gara 32 tti gad buuse, kan 100'tti siqan ammoo ammallee wallaansa argachaa jiru."
"Germany recruits 8,500 teachers to provide special German language lessons for 196,000 Syrian child refugees.","Jarmaniin koolu-galtoota ijoollee Siiriyaa 196,000 ta'aniif barumsa afaan Jarman akka barsiisaniif barsiisota 8,500 qaxarte."
"The dam, to be completed by 2017, has raised concerns in Egypt that it will cut supplies of water allocated by accords put in place more than five decades ago.","Itoopiyaan Wiirtuu Humna Ibsaa Bishaan irraa maddu meegaawaattii 6,000 Laga Biluu Naayil, ya'aa ijoo Laga Naayil isa Gibxiif bishaan ishii hedduu dhiyeessuuf irratti, biliyoona $4.3'n ijaaraa jirti."
"Huawei installed the up-to-date telecom equipment in the AAU pharmacy campus for educational purposes. After 3 years’ know-how transfer, Addis Ababa University will gain 100% ownership of the ICT Practice Center.","Haawween dhimma barnootaaf AAU kampaasii faarmaasii keessatti meeshaa teelkoom haara'aa tahe dhaabe. Waggoota 3 akka itti dabarsan baruu booda, Yuunivarsitiin Addis Ababaa abbummaa Giddugala Shaakala ICT 100% ni fudhata."
Trade is suspended on the Shanghai Stock Exchange and Shenzhen Stock Exchange for a second time in a week after share prices tumble following the devaluation of the yuan.,Daldalli Sharafa Aksiyoonaa Shaangaayii fi Sharafa Aksiyoonaa Sheenzen irraa gatii yu'aan gadi hir'achuu isaa hordofuun erga gurgurtaan aksiyoonaa kufee booda torban tokko keessatti yeroo lammataaf adda cite.
Shangtex is the second largest textile company in China.,Shaangiteks Chaayinaa keessatti dhaabbata huccuu guddinaan lammaffaa dha.
"The US launches a fourth round of air strikes targeting Islamic State fighters near Erbil, and Kurdish forces regain control of two towns in Nineveh province after heavy fighting.","US naannoo Irbilitti loltoota Isilaamik Isteet xiyyeeffachuun haleellaa qilleensa irraa marsaa afuraffaa eegalte, humnoonni Kurdish lola ulfaataa booda deebisanii magaalaa lama kutaa bulchiinsaa Naayinawee keessaa to'atan."
They call it “the lung of Addis Ababa”.,"Isaan ""Somba Addis Ababaa"" jedhanii waaman."
Star Trek Into Darkness earns an estimated US$70.6 million during its opening weekend in the US and Canada.,Istaar Tireek Intuu Daarkines US fi Kaanaadaa keessatti dhuma torbanii waqtii baniinsa isaa keessatti miliyoona US$70.6'tti tilmaamamu argate.
Israel blocks all Palestinian export of agricultural products from the occupied West Bank following Palestinian limitations on imports of Israeli cattle.,"Filisxeem horii gaanfaa Isiraa'el gara biyya ishee galchuu daangesuun, Isiraa'el alargee oomisha qonnaa Filisxeem kan Weest Baank isa qabame irraa dhufu hundumaa dhorkite."
Mali's interim President Diouncounda Traore returns to the country after a two-month absence.,Pirasdaantiin yeroo Maalii Diyookundaa Tiraa'oree ji'a lamaaf erga dhabamee booda gara biyyattiitti deebi'e.
"The first to East Africa, the 2.1 million USD investment of the project includes a donation scope of 1.9 Million USD worth of equipment for training and demonstration, and the Train the Trainer program to Addis Ababa Institute of Technology (AAiT) teaching staff.","Afrikaa Bahaatiif isa jalqabaa kan tahe, pirojektiin investimentii USD miliyoona 2.1 arjooma meeshaalee leenjii fi shaakalaa, fi sagantaa leenjisaa leenjisuu hojjetoota barsiisota Inistitiyuutii Tekinoolojii Addis Ababaa (AAiT)f USD miliyoona 1.9 baasu dabalata."
Former television journalist Shelly Yachimovich is elected as the head of the Israeli Labor Party.,Gaazexeessaan televiijinii duraanii Sheelii Yaachimoovich akka dursaa Jaarmiyaa Labarii Isiraa'elitti filataman.
"The Ethiopian Athletics Federation (EAF) is scheduled to celebrate the ‘global running day’ with a one-mile race on Wednesday, June 6, 2018.","Federeeshiniin Atileetiksii Itoophiyaa (EAF) 'guyyaa figicha adunyaa' dorgommii maayila tokkootin kabajuuf Roobii, Waxabajjii 6, 2018 beellameera."
WHO Director-General Tedros will attend the 32nd Ordinary Session of the Assembly of Heads of State and Government of the African Union.,Daayirekterri-Olaanaan WHO Tediroos walga'ii idilee bulchitoota biyyoot fi motummootaa gamtaa Afiriikaa 32ffaa ni hirmaatu.
"In a meeting held late on Friday, the Ministry of Trade and Industry (MoTI) consulted business owners and managers from the Tigray region on ways of addressing the problems companies faced during the operation.","Walgayii Jimaata ta'e irratti, Ministeerri Daldalaa fi Industirii(MoTI) abbootii qabeenyaa fi hoggantoota daldalaa naannoo Tigiraay irra dhufan daandiiwwan ittiin raakkoolee kubbaaniyyoonni yeroo duulichaatti isaan mudate furanii irratti gorsan."
A journalist for the British newspaper Financial Times is killed by a crocodile in Sri Lanka.,Gazixeessaan gaaazexaa Biriteen kan ta'e Faayinaanshaal Taayimsiif hojjetu Sirilaankaa keessatti naachaan nyaatame.
"The Emperor of Exmoor, a red deer believed to be Britain's largest wild animal, is shot and killed.","Mootiin mootota Eksimoor,bineensa bosonaa guddicha Biriteen jedhamee kan amanamu bosonuun Diimaan rasaasaan rukutamuun ajjeefame."
"Ethiopia announced an immunization campaign to vaccinate more than 7 million Children against polio next week, according to Ethiopian Public Health Institution.","Itoopiyaan torban dhufu ijoollee milyoona 7 akka pooliyoon hin qabne talaaluuf duula madiinummaa beeksifte, akka Dhaabbata Fayyaa Hawaasaa Itoopiyaatti."
The Ethiopian National Football Team has qualified for the Africa Cup of Nations (CAF) today.,Har'a Gareen Kubbaa miilaa Biyyoolessaa Itoophiyaa Waancaa Biyyoota Afiriikaatif(CAF) darbe.
Yonhap News Agency reports that North Korea has fired two projectiles from Pyongan Province into the Sea of Japan.,"Ejensiin Oduu Yonhaap, Kooriyaan Kaabaa furguggifamaa lama Piroviinsii Piyoongaan irraa gara Galaana Jaappaanitti akka dhukaaste gabaase."
"During the event, a memorandum of understanding was also signed for P4G, the Partnering for Green Growth and the Global Goals 2030 which is an initiative with 12 middle-power partner countries including Denmark and South Korea.","Yeroo qophichaa, waliigalteen walhubannaa P4G. Guddina Magriisaa fi Galma Addunyaa bara 2030 michoomuu kan kaka'umas Denmaarkii fi Kooriyaa Kibbaa dabalachuun biyyoota humna giddugaleessaa 12 fis mallatteeffame ture."
"A judge in Amsterdam delays the extradition of the man suspected of a lethal stabbing on the Bruges Market Square, citing concerns over the living conditions in Belgian jails.","Abbaan seeraa Amisterdaam keessaa dabarfamee kennamuu namicha waraansa hamaa Iskuweerii Gabaa Biruuges irraan shakkame, yaaddoo haalota jireenya manneen hidhaa Beeljiyeem caqasuun tursiise."
"Radar scans at the tomb of Tutankhamun, Pharaoh of Ancient Egypt, reveal two chambers adjoining the tomb, raising prospect of finding the resting place of Queen Nefertiti.","Raadaariin iddoo awwaalcha Tutankaamun, Fara'oonii Gibxi Durii qoratu, kutaawwan lama iddoo awwaalchaa sana akka walitti buusan, bakki awaalchaa Mootittii Nefertittii argamuu akka danda'u adda baase."
"The President of Spanish Football Federation and Vicepresident of FIFA and UEFA, Ángel María Villar, is arrested with his son amid a corruption scandal.",Pireezidaantiin federeeshinii kubbaa miilaa Ispeen fi itti aanaan pireezidaantiin FIFA fi UEFA kan ta'an Anjeel Maariyaa Villaar salphina malaamaltummaa keessa osoo jiranii ilma isaanii waliin to'annaa jala oolan.
"The United States Border Patrol finds a sophisticated tunnel between Tijuana in Mexico and Otay Mesa, California, used by drug smugglers.",Eegdonni daangaa yunaaytid Isteetis holqa nam-tolchee haalaan ijaarame kan daldaltoonni baala sammuu nama adoochu itti fayyadama turan giddulameen magaalota kutaa Meeksiikoo tijuwaana fi kutaa Kaaliforniyaa Otaay Meesaa kessaatti arganiiru.
"New York-based Human Rights Watch says that more than 400 people have been killed in clashes with the security forces in Oromia, although the government disputes this figure.","Falmattoonni Oromoo baayyeen mana hidhaa qaalitti tursama, akka miidiyaan mormitoota deggeru jedhetti."
"The second President of Kazakhstan, Kassym-Jomart Tokayev, is sworn into office, after the resignation of Nursultan Nazarbayev.",Aangoo gadilakkisuu Nuursultaan Nazaarbayev 'iin walqabatee Pireezidaantiin Kazaakistaan Lammaffan Kaasim Joomaart Tokaaye kakuu rawwachuun wajjira seenan.
"18,000 Palestinians are facing life-threatening shortages of water in the Yarmouk Camp neighborhood of Damascus.","Lammiiwwan Filisxeem 18,000 tahan Dunkaana Yaarmok ollaa Daamsqoo keessatti hanqina bishaanii miidhaa lubbuu qaqqabsiisuu danda'uutu isaan quunnamaa jira."
"Sponsored by U.S. Embassy and the Japan International Cooperation Agency (JICA), the program helps Ethiopian youth to develop tech-based solutions to address community challenges.","Imbasii U.S fi Ejensii Waltahumsaa Addunyaalessaa Jaappaan (JICA)'n kan deggeramu, sagantichi dargaggoonni Itoopiyaa akka isaan furmaata tekinoolojii irratti hundaa'een rakkoowwan hawaasaaf furan gargaaruufi."
