en,om
"Using Google Maps, an archaeologist finds nearly 2,000 potential archaeological sites in Saudi Arabia.","Guugil Maap fayyadamuun, arkiyoolojistiin tokko Sa'ud Arabiyaa keessatti bakkeewwan arkiyoolojii tahuu danda'an 2,000 tti dhiyaatan argate."
"Among the inhabitants residing around the dam, Abdi Haji told ENA that “the power project plays immense role in their lives in terms of road connectivity, irrigation, energy as well as job opportunity.”","Jiraattooa naannoo hidhicha jiraatan keessaa, Abdii Hajii "" piroojektiin humna ifaa gama qunnamtii daandii, jallisii, anniisaa akkasumas carraa hojiitiin shora olaanaa taphata"" jechuun ENA'tti himeera."
"The Kremlin announces that Russia will hold the 2014 G8 summit in its southern Black Sea resort of Sochi, the host of the 2014 Winter Olympics.",Kiremiliin Qopheessituun Oloompikii gannaa bara 2014ii kan taate 'Saawuzern Bilaak Sii' resoortii 'Soochii' keessatti Raashiyaan Yaa'ii G8 kan bara 2014ii akka geggeessitu beeksiste.
"Winds gusting up to 100 miles per hour have been recorded over much of the United Kingdom and Ireland, causing widespread damage and disruption.",Yunaytid Kiingidamii fi Aayerlaand keessatti bubbee furgugifamaa sa'a tokko kessatti maayila 100 fiigu galmaa'een diigamsa fi badii guddaan qaqqabeera.
He assured farmers that the mature locusts do not inflict damage on the crops right now.,Hawaannisi gaheeyyiin sun midhaan irratti miidhaan akka hin qaqqabsiisne qote bultootaaf mirkaneesse.
"Ras Theater Director, Meron Teshale told ENA that art has a power to strengthen unity in diversity and show diversity as a source of peace and harmony.","Daarikterri Tiyaatira Raas, Meeron Teshaalee aartiin tokkummaa garagarummaa keessatti jabeessuuf fi adda addummaa akka madda nagaa fi jaalalaan waliin jiraachuutti agarsiisuuf humna qaba jette."
The Ethiopian national anti-doping office said it has begun doping tests on athletes.,Waajjira farra qoricha nama jajjabeessuu Itoophiyaa qorannoo qoricha nama jabeessuu atileetota irratti akka eegale hime.
"Briefing journalists, Public Health Institute Director-General Dr. Eba Abate said similar taskforces formed in regions are making preparations to prevent the virus.","Gaazexessitootaaaf ibsa kennaniin, Daayirekterri-Olaanaan Inistitiyuutii Fayyaa Hawaasaa Dr. Eba Abaatee koreen duulaa walfakkaatoon naannoleetti uumaman qophii vaaayiresicha ittisuuf gochaa jiru jedhan."
U.S. President Donald Trump announces new sanctions on North Korea over its nuclear weapons program.,Pirasdaantiin U.S. Doonaald Tiraamp Kooriyaa Kaabaa irratti dhimma sagantaa meeshaa waraanaa niwukilaaraa ishii irratti qoqqobbiiwwan haaraa akka kaa'u beeksise.
Cardell Hayes is found guilty of manslaughter by a Louisiana jury in the road rage shooting death of former New Orleans Saints star Will Smith.,Urjiin New Orliins Seentis duraanii Wiil Ismiiziin daandii irrattii aariin guutamuun dhukaasee ajjeessuu isaataa abbaan murtii Luuziyaanaa himatamaa Kaardel Haayes balleessummaa isaa mirkaneesse.
The study also highlights the negative impacts of other government offices also having prosecutorial authority.,Qorannichi dhiibbaa gaarii hin taane kan biiroowwan mootummaas aangoo abbaa alangummaa qabanis ibseera.
"A beaver is seen in Northern Italy on camera, a species that has not been seen in the country since 1471.","Biiveriin, Kaaba Xaaliyaanii keessatti kaameraa irratti argame, sanyiiwwan erga bara 1471 biyyattii keessatti argamanii hin beekne."
"North Korea’s foreign ministry, in an official statement, says the latest United Nations sanctions are an act of war and are, in effect, a complete economic blockade.","Ministeerri dhimma alaa Kooriyaa Kaabaa, ibsa isaa keessatti, qoqqobbiiwwan Mootummoota Gamtoomanii inni boodanaa, gochaadhaan, daangesuun guutummaa diinagdee, gochaa waraanaa ti waraanas jedhe."
A triple suicide bomb attack north of Tikrit kills at least 11 and injures another 34 members of Iraqi security forces.,Naanoo kaaba Tikriikitti Gocha badee balleessaa boombii sadeen raawwaatameen yoo xiqqaate namoonni 11 yoo du'an miseensonni humna nageenya Iraaq 34 ammoo miidhamaniiru.
This encouraging conclusion was received nearly two years after the outbreak was confirmed in the Horn of Africa and outbreak activities initiated to respond to and interrupt Polio transmission.,Guduunfaan nama jajjabeessu kun muldhifame weerarichi Gaanfa Afrikaa keessatti argamuun mirkanaa'ee hojiileen weeraricha ittisuu jalqabsiifamee tatamsa'ina pooliyoo erga adda kutee waggoota lama booda tahe.
"Scientists discover a large colony of more than 750,000 pairs of Adélie penguins on the Danger Islands in Antarctica.","Saayintistoonni gurmuu guddaa pengiyuunii Addellee cimdii 750,000 caalan Odolaa Daanjerii Antarkaatikaa keessaa irratti argatan."
Albania's prime minister is embroiled in scandal after his brother is linked to the stunt.,Muummichi ministeera Albeeniyaa obbeleessi isaanii mala kutuu waliin hidhata qabachusaatiin qaanii guddaa kessaa seenan.
"In 2011, all the regions in the country except the Somali Region were validated for MNTE. The 2011 validation mission made recommendations that would see the Somali Region progress to MNTE over time.","Bara 2011 keessa, Naannoo Somaalee irraa kan hafe naannoleen biyyattii keessa jiran hundi MNTE'f mirkaneeffaman. Ergamni mirkaneessa bara 2011 gorsawwan Naannoon Somaalee yeroo keessa gara MNTE'tti akka guddatu gargaaru kenne."
Thailand expresses its interest in hosting the planned summit meeting between U.S. President Donald Trump and North Korean leader Kim Jong-un.,Taayilaand marii Pirasdaantii U.S. Doonaald Tiraampii fi Hogganaa Kooriyaa Kaabaa Kiim Joong-Un gidduutti karoorfame qopheessuf fedhii akka qabdu ibsite.
"The institute would in particular help to reduce the widespread deforestation and enhance the utilization of forests, the minister added.","Inistiitiyuutichi keessattuu manca'ins bosonaa babal'ataa jiru hir'isuu fi itti fayyadama bosonaa dabaluu irratti ni fayyada, jedhe minsteerich itti dabaluun."
US clothing company Gap Inc. agrees to distribute their apparels to Chinese e-commerce company JD.com.,Dhaabbanni uffataa US Gap Inc.'n uffatoota isaa dhaabbata daldala interneetaa Chaayinaa JD.com'f raabsuuf waliigale.
"In March alone, the carrier transported donations made to Africa by the Chinese business mogul Jack Ma in six days for all 54 African countries, the CEO stated, adding that “many African countries were surprised how the airlines distributed the medical equipment in a very short period of time.”","Bitootessa qofaatti, baataan kun kennaa daldalaa gameessa Chaayinaa Jach Ma'dhaan Afirikaaf guyyaa jaha keessatti biyyoota Afiriikaa 54'n hundaaf godhame geejjibeera, hoji-geggeessaan kun tuquun, ""biyyoonni Afiriikaa hedduun akka itti daandiin xiyyaaraa kun yeroo baayye gabaabadu kana gidduutti meeshaalaa fayyaa rabseen dinqamaniiru"" jechuun dabalaniiru."
The UN Relief and Works Agency for Palestine Refugees in the Near East declares a state of emergency on the Gaza Strip following heavy floods.,Dhaabbanii gargaarsa UN fi naannoo bahaatti dhaabbileen baqattoota filisxeem sababa lolaa hamaa mudateen Odola Gaazaa irratti labsii yeroo hatattamaan dabarse.
Fekadu Alemu has got a hat-trick in the game by scoring all the three goals for Fasil Kenema while Baye Gezahegn netted the only goal of Hadya Hosaena.,Fikaaduun Alamuu Faasil Kanamaadhaaf galii sadii galchuun hatrikii yoo hojjetu Baayyee Gezzahany ammoo gaalii tokkicha Hadya Hosaa'inaadhaaf galcheera.
"President Nursultan Nazarbayev of Kazakhstan announces that the Kazakh language will begin using a Latin script, rather than the current Cyrillic script.",Pirasdaantiin Kaazaakistaan Nursulxaan Naazarbaayev afaan Kaazaak kan amma jiru qubee Saayirilik malee qubee Laatinii fayyadamuu akka eegalamu beeksise.
"Ash clouds from the erupting Puyehue-Cordon Caulle in Chile disrupt and cancel international flights, leaving thousands stranded.","Chiilee kessatti sababa dhooyinsa puyee-Cooliitiin Hurrii hamaa mudateen imaalli xiyyaraa addunyaa hedduun haqamuun ,namooota kumaatamatti lakkaawwaman sochii dhorke."
"According to chief of staff of the African Union chairperson, Ambassador Abdoulaye Diop the next congress will take place at the AU’s headquarters in Addis Ababa in May 2020.",Akka dura ta'aa dura bu'oota Gamtaa Afiriikaa Ambaasaaddar Abdolaayee Diyoop'tti kongirasiin itti aanuu Caamsaa 2020tti Finfineetti teessoo AU'tti ta'a.
The Organisation for the Prohibition of Chemical Weapons reports that Syria has handed over data on its chemical weapons program.,"Dhaabbanni Ittisa Meeshaalee Waraanaa Keemikaalaa, Sooriyaan daataa sagantaa meeshaalee waraanaa Keemikaalaa ishee akka kennite gabaase."
A firefighting helicopter searching for missing people from the sinking of the MV Sewol in April crashes in the South Korean city of Gwangju with five people aboard.,Xiyyaarrii ittisa bala abiddaa namoota ji'a Eebilaa keessa dhidhima MV Sewoliin achii-buuteen isaanii dhabame barbaachaa turte kibba Kooriyaa magaalaa Guwaanju kessatii imaltoota shan waliin kufte.
The United States Department of State issues a travel warning to United States citizens for the country of Algeria in response to the In Aménas hostage crisis.,Ministeerri Haajaa Alaa Yunaayitid Isteetis miidhaa hidhamtoota Amenaasiin walqabatee biyya Aljeeriyaaf lammiiwwan Yuunayitid Isteetis irra akeekkachiisa imalaa keesse.
"Hub of Africa, with the support of Vogue Talents and the Italian Embassy in Addis Ababa will showcase eight visiting designers and six established Ethiopian designers who have showcased their designs on global catwalks from October.","Galmi Afrikaa, deggersa Voog Taalentii fi Imbasii Xaaliyaan Addisa Ababaa keessaatiin dizaayineroota daawwattoota saddeetii fi dizaayineerota hundaa'an lammii Itoopiyaa ja'a kanneen hojii isaanii Onkoloolessa irraa jalqabuun kaatwook addunyawaa irratti agarsiisan ni dhiyeessa,"
"Following the qualification of the Ethiopian men's national team (Walias) to the 2022 African Cup of Nations (AFCON) in Cameroon after an eight year absence from the tournament, over 500 fans and 25 sports journalists are set to attend the event to be held from January 9 – February 6, 2022 in Cameroon.","gareen biiyyaleessa Itiyoophiyaa dhiirotaa (waaliyoonni) waggoota saddeetiif dorgommii irraa hafuun booda dorgommii waancaa biyyoota Afirikaa (AFCON) 2022 kaameeruun kessaaattii qophaa'uuf darbuun isheetiin , ajaa'ibsiifattootni 500 olii fi gaazexessitootni ispoortii 25 qophii gaggeefamuuf jedhu hirmaachuf."
"Wendy Chapman, the doctor at the centre of the Bloodgate rugby union scandal, is summoned to a disciplinary hearing on 23 August.","Wendii Chaapmaan, doktoorri giddugala waldaa hamii rabgii Bleedgeet, dhaddacha naamusaa gaafa Hagayya 23'tti waamame."
"Meanwhile, the 29th International Day of Persons with Disabilities has been marked in Bahir Dar yesterday under the theme “Building Back Better: toward a disability-inclusive, accessible and sustainable post-COVID-19 World”.","Kun utuu kanaan jiruu, guyyaan Namoota Qaama miidhamummaa qabanii Addunyaalessaa 29ffaan kaleessa Baahir Daar keessatti mata duree ""COVID-19 booda addunyaa qaama miidhamummaa hammatte, argatamuu kan danda'uu fi walitti fufaa, fooyyeessanii deebisanii ijaaruu"" jedhuun kabajame."
"Leza, a radio show on Sheger FM 102.1 hosted by Berhanu Digaffe, has been organizing Leza Awards for seven years now.","Lezaa, qophii raadiyoo FM shegger 102.1 irraa Birhaanuu Diggafeen qopheeffamu, haga ammaatti waggaa torbaaf Badhaasa Lezaa qopheessaa tureera."
The Ministry of Health has announced that it is spraying anti-malaria chemicals in 160 Woredas in order to wipe out mosquito following the rainy season the country has been experiencing.,Ministeerri Eegumsa Fayyaa waqtii roobaa biyyattii keessa jirtu hordofuun bookee balleessuuf keemikaalota farra malaariyaa Aanaalee 160 keessatti biifaa akka jiru beeksise.
The interim President of Ukraine Olexander Turchynov orders Ukrainian forces to withdraw from Crimea.,Pirasdaantiin yeroo Yukiriyeen Oleksaander Turchynoov humnoonni waraanaa Yukiriyeen akka Kirimiyaa keessaa bahan ajajan.
The government of Ethiopia awarded and honored the national athletics team that participated in the Tokyo 2020 Olympics in a grand ceremony held at the National Palace on Thursday in the presence of President Sahilework Zewde.,Mootummaan Itoophiyaa garee atileetiksii biyyoolessaa Olompikii Tokiyoo 2020 irratti hirmaate sagantaa guddaadhaan Kamisa masaraa biyyoolessaatti bakka Pirezidaantii Sahilewarw Zawudee argamanitti badhaaseera akkasumas kabaja kenneera.
The target for this sector has been set at 42.85 million USDs.,Galmi sektara kanaa USD miliyoona 42.85tti ka'amee ture.
Canadian Physicians for Aid and Relief (CPAR) and Global Affairs Canada are set to spend approximately 110 million Birr (4.1 million CAD) to help Ethiopia with sexual reproductive health (SRH) of women and adolescents.,Gargaarsi Bayyanachiisaan Hakiimoota Lammii Kanaadaa (CPAR) fi Haajaan Addunyaa Kanaadaa fayyaa saalaa fi walhormaataa (SRH) durbartootaa fi saafelootaa Itoopiyaa gargaaruuf Birrii tilmaamaan miliyoona 110 (CAD miliyoona 4.1) tahu baasii gochuuf karoorfate.
The Minnesota Twins win the American League Central in Major League Baseball and become the first team to qualify for postseason play in 2010.,Tiwiinsiin Minesotaa Liigii Beezboolii Meejerii keessatti Liigii Giddugalaa Ameerikaa mo'atee garee jalqabaa tapha dorgommii boodaa 2010'f darbe isa jalqabaa ta'e.
"Over the next five years, the new program will focus on mobilizing increased domestic resources and streamlining medical insurance schemes to expand coverage to millions more people.","Waggoota shanan dhufanitti, sagantaa haaraan qabeenyaa biyya keessaa fayyadamuu irratti fi inshuraansii fayyaa miliyoonotaaf qaqqabu ballisuu irratti xiyyeefata."
Japanese toilet industries agreed to standardize the iconography of electric toilet seat controls in order to make them less confusing for users.,Industiriin mana fincaanii Jaappaan fayyadamtoota akka hin rakkisne gochuuf agarsiistuu mallattoo mana mincaanii elektirikaa waaltessuuf waliigalan.
"Oklahoma becomes the first U.S. state to carry out an execution with pentobarbital, a lethal injection drug used for euthanizing animals.",Ooklaahoomaan qoricha waraansaa ajjeesaa akka Bineensota dadhabsiisuuf oolu adabbii du'aa raawwachuuf itti fayyadamuun kutaalee biyya Ameerikaa keessaa kan jalqabaaa taaate.
"Bereket was serving as deputy head of Policy Studies and Research Centre, an institution set up to aid the PM in high-level policy issues.","Barakat akka itti-aanaa dura-ta'aa Qo'annoowwan Immaammataa fi Giddugala Qorannoo ta'uun tajaajila turaniiru, giddugalichi Ministeera Muummee dhimmoota imaammataa sadarkaa olaanaa irratti gargaaruuf dhaabbate."
The Gada system is an indigenous democratic and socio-political system of the Oromo people.,Sirni Gadaa diimokiraasii durii fi sirna siyaas-hawaasummaa ummata Oromooti.
"The bank has launched a booking system called Gate Rooms, which enables the diaspora to book hotels from where they are, the CEO revealed, adding that members of the diaspora who come to Ethiopia could easily make booking, pay, and book online.","Baankichi sirna bakka-qabannaa Get Ruums jedhamu gadlakkiseera, kunis diyaaspooraan bakka jiranii hoteelota akka qabatan ni dandeessisa, hoji-gaggeessa olaanaan ifoomsuun, miseensonni diyaaspooraaa gara Itoophiyaa dhufan bakka-qabannaa, kaffaltii, fi toora irratti bakka akka salphaatti qabatan dabalaniiru."
The Dance of King David is a documentary film about the history and the contemporary worship of the Ark.,Sirbi Mooticha Daawit fiilmii dookumentarii waa'ee seenaa fi waaqeffannaa taabotaa yeroo ammaa ti.
The Czech Republic temporarily imposes a ban on hard liquor after a spate of deaths related to bootleg hard alcohol poisoning.,Rippaabiliki Cheek erga du'i sababii summaa'uu alkoolii jabaa seeraan alaan mudate baayyatee booda yeroodhaaf dhuqaatii jabaa irra uggura keesse.
"Zerfie said the new technology avoids the use of water, salt and sulfuric acid and formic acid.","Zarfeen teekinooloojii haaraan kun fayyadamaa bishaanii, ashaboo fi salfarik asiidii fi formik asiidii ni ittisa jedhaniiru."
"However, the athlete was also under investigation for various misdemeanors, disrupting the investigation process and attempting to defraud officials.","Haa ta'uyyuu malee, akkasumas atileetichi balleessaa hedduudhaaf qorannoo jala ture, sirna qorannoo jeeequu fi aanga'oota qowwomsuuf yaalun."
"According to IMF, the $2.9 billion program would facilitate Ethiopia’s transition to flexible exchange-rate system.","Akka IMF'tti, sagantaan dolaara 2.9 biliyoona cee'umsa Itoophiyaa gara sirna sharafaa mijataatti ni mijeessa."
The United States notifies the United Nations of its formal withdrawal from the Paris Agreement.,Yunaayitid Isteetis Waliigaltee Paaris keessaa ifaan bahuu ishee Mootummoota Gamtooman beeksifte.
"Addressing Climate Ambition Summit 2020, Prime Minister Abiy Ahmed said that Ethiopia has taken bold leadership on climate action by launching its ambitious climate resilient green economy strategy that aspires to build a carbon neutral and resilient economy by 2030.","Walgahii Fedhii Haala Qilleensaa 2020 irratti yeroo dubbatan, Muummeen ministeeraa Abiyyi Ahimed Itoopiyaan tarsiimoo diinagdee magariisa jijjiirama qilleensaa dandamatu kan kaarbonii irraa bilisa tahee fi diinagdee damdamatu ijaaruuf kan kaayyeffatu jalqabuun geggeessummaa jabaa haala qilleensaa irratti fudhatteetti jedhan"
"BlackBerry Limited announces it will purchase Good Technology, a provider of mobile software, as part of its broader shift to a services role within the internet of things.","Bilaakbeerii Limiitid akka gahee isaa bal'aa isaa tajaailaoota interneetii wantootaa keessaatti dhiyeessaa sooftiweerii mobaayilaa, Guud Tekinoolojiin akka bitu beeksise."
"He was known for his instrumental version of shellela, a genre of traditional Ethiopian vocal music sung by warriors before going into battle.","Gosa sagalee meeshaa muuziqaa mataa isaa shillelaa jedhamu, muuziqaa aadaa sagalee loltootaan utuu gara dirree lolaatti in bahin weellifamuun beekama."
"The first Irrechaa Great Run is scheduled to take place in Addis Ababa on September 22, 2019","Figichi Irreechaa Guddichi jalqabaa Fulbaana 22, 2019 Finfinneetti gaggeefamuuf saganteeffamee jira."
"Coffee may prolong the human lifespan, suggests one study by Imperial College London and the International Agency for Research on Cancer, and another by the Keck School of Medicine of USC.","akka qorannoon 'Impeeriyaalii Koolleejjii Landan""ii fi dhaabanii qorannoo dhibee Kaansarii addunyaa fi kanbirron ammoo manni barnootaa fayyaa 'Keek USC' jedhaniitti bunni dandeetii umurii namaa dheeressuu akka qabu akeekan."
The Hong Kong government backs down on plans to introduce Chinese patriotism classes in its schools after weeks of protests.,Motummaan Hoongi Koong mormiwwan torbanootaaf godhamaniin booda karoora barumsa Gootummaa chaayinoota barsiisu manneen barnootaa keessatti jalqabsiisuuf ture dhiise.
American Samoa bans smoking in all public and private enclosed spaces.,Saamo'aan Ameerikaa bakka ummataa fi dhuunfaa cufamee jiru hundatti tamboo xuuxuu dhorke.
"In California, Oakland police disperse Occupy Oakland protesters, using tear gas and rubber bullets and making numerous arrests.",Kaalifforniyaa keessatti Poolisoonni Ookilaand mormitoota bakka qabatan turan tamsaasuuf Gaasii imiimmaan buusuu fi rasaasa Pilaastikaa fayyadamuun bittinneessan dabalataanis namoonni hedduun to'anna jala oolaniiru
"“These efforts will help spread security and stability to all the Somali people,” he said.","Akka Ambaasaadarri Asminewu jedhetti, humnoonni Itoopiyaa humnoota Somaaliyaa leenjisuun humna biyyaalessaa jabaa of danda'uun ergana geggeessuu danda'u ijaaruuf itti gaafatamummaa dabalataa fudhataniiru."
Religious fathers serving at Lailbela Rock-hewn churches appreciated the visit of French President Emanuel Macron and requested speedy renovation of the historical site.,Abbootiin amantii bataskaanota Rook-hewaan Laallibalaatti tajaajilan daawwannaa Pirasdaantii Faransaay Imaanu'eel Maakiroon jajuun bakkeen seena qabeessichi akka ariitiin haareffamu gaafatan.
The project is expected to be completed eight to ten years.,Pirojektichi waggoota saddeetii haga kudhaniitti xumuramuu danda'a.
"The LIGO Scientific Collaboration experiment announces the first direct observation of gravitational waves. , ,",Walta'iinsi yaalii saayinsaawaa LIGO danbalii humna harkisaa lafaa yeroo jalqabaatif arguu isaanuu ibsan
"This is the second installment of African Film Week, the first launched in 2016 with the African Union Culture Department.","Kun geggeeffamuu Torban Fiilmii Afirikaa isa lammaffaa dha, inni jalqabaa bara 2016 keessa Muummee Aadaa Gamtaa Afrikaa wajjin bara 2016 keessaa eegalame."
The Carnival of Aalst in Belgium goes ahead despite UNESCO withdrawing its recognition of the event as a Masterpiece of the Oral and Intangible Heritage of Humanity because of Jewish caricatures.,Sababa kiraakchara yihuudotaatin UNESCO'n beekamtii akka taatee addaa kan afoolaa fi hambaa afuuraa namoomaatti kenneef irraa mulquyyuu ayyaaneffannaan Karnivaalaa Alist kan beeljiyeemitti gaggeeffamu itti fufa.
Kana now produces nearly 30 hours of fresh content per week in Amharic.,Qaanaan amma torbanitti Amaariffaan qabiyyee haaraa sa'atiiwwan 30'tti dhiyaatu qopheessa.
"Evaluation aims to bridge skill gaps in health workers thereby realize quality services in the sector, Alemtsehay noted.","Madaalliin hanqina ogummaa hojjetoota fayyaa guutuun sektericha keessatti tajaajila qulqullina qabu mirkaneessuuf kaayyeffate, jette Alemtsehaay."
"The last known female Yangtze giant softshell turtle, the world's largest species of freshwater turtle and one of the most endangered species on the planet, dies at Suzhou Zoo in China.","Dhalaan qocaa dugda laafaa isheen dhumaa beekamtuun guddittiin Yaangize, sanyiiwwan qocaa bishaan qulqulluu guddaa addunyaa fi sanyiiwwan pilaaneticha irraa garmalee baduu gahanii, Paarkii Bineensotaa Suuzuu Chaayina keessaatti duute."
"The station, which is constructed in the compound of the agency's Adama branch, is expected to provide data that will help to measure the level of the pollution trends in the city.","Buufatichi, kan mooraa damee ejensichaa Adaamaa keessatti ijaarame, daataa jijjiirama sadarkaa faalama magaalicha keessaa safaruuf gargaaru dhiyeessuun irraa eegama."
"Ethiopians regardless of different backgrounds, and from far or near together marched to Adwa, where they crushed aggressor Italian forces.","Itoopiyaanonni dubduubee isaanii garagaraa malee, fagoo fi dhiyeenya irraa waltahanii gara Aduwaa, bakka itti humnoota weerartoota xaaliyaanii tti caccabsanitti duulan."
The SpaceX Dragon capsule on a re-supply mission to the International Space Station returns to Earth.,Manneen Diraagonii Ispeeseks ergama irra deebii dhiyeessii gara Giddugala Addunyaalessaa Hawaatti godhame booda gara Lafaatti deebite.
"The exhibition at the headquarters of Ministry of Innovation and Technology will remain open until December 14, 2019.","Agarsiisni teessoo Ministeera Kalaqaa fi Tekinooloojiitti geggeefama jiru hanga Mudde 14, 2019tti banaa ta'ee ture."
Addis Ababa January 23/2019 Prime Minster Abiy Ahmed said that Ethiopia is working to enhance the engagement of the private sector in order to ensure more inclusive and socially sustainable growth.,Finfinne Amajjii 23/2019 Muummichi Ministeeraa Abiy Ahimed Itoophiyaan guddina caalaatti haammataa fi hawaasummaan walitti fufaa ta'e mirkaneessuuf hirmaatumma seektaroota dhuunfaa foyyeessuuf akka hojjeechu jirtu dubbataniiru.
Facebook is teaming up with the Government of Ethiopia to help inform millions of Ethiopians with what it says will be “valid and up to date information on COVID–19.”,"Feesbuukiin Mootummaa Itoopiyaa waliin tahuun ummata Itoopiyaa miliyoonaan lakka'amu isa ""COVID-19 irratti odeeffannoo sirrii fi ho'aa"" dha jedhu isaan biraan gahuuf."
The United Nations Children's Fund reports that an outbreak of the deadly Ebola virus that has so far claimed the lives of 59 victims has spread from southern Guinea to the capital Conakry.,akka Dhaabbanni Fundii Daa'immanii Mootummoota gamtoomanii gabaasetti weerarri dhibee balaafama Vaayirasii Iboolaa kana hanga ammatti namoota 57 galaafachuun isaa beekame kun gara kibba Giinii magaalaa guddoo konakriittii babal'ateera.
"Mulatu Astatke’s trailblazing album, Mulatu of Ethiopia, was officially rereleased on Friday May 19.","Albamiin kalaqaa Mulaatuu Astaatikee, Mulaatuu isa Itoopiyaa, Jimaata Gaafa Caamsaa 19 irra deebiin ifaan gadhiifame."
State Minister of Education Dr. Geremew Huluka told journalists during the event that the government has changed the curriculum to encourage science and innovation in schools starting from the lower classes.,Ministeerri ministeera Barnootaa Dr. Garramaw Hulluuqaa qophicha irratti mootummaan sayiinsii fi kalaqa jajjabeessuuf manneen barnoota keessatti kutaalee gadii irraa eegalee sirna barnootaa jijjiiruu isaa gaazexesittootatti himaniiru.
This year’s 18th Great Ethiopian Run has grown to become a major street festival in Africa attracting thousands locals and foreign tourists every year.,Fiigichi Guddaan Itoophiyaa 18ffaan bara kanaa wagga waggaan jiraattootaa fi tuuristoota biyya alaa kumaataman lakkawaaman harkisuun Afiriikaa keessatti feestivaala daandii irraa isa guddicha gara ta'uutti guddatee jira.
The inquiry into the Deepwater Horizon oil spill in the Gulf of Mexico is released finding that the accident was entirely preventable.,Galoo galaana meeksiikoo keessatti kan argamu Deepwater Horaayizon keessattii qorannoo taasifameen dhangala'iinsi boba'aa mudate kan ittisuun danda'amaa ture ta'uun beekame.
