en,om
India offers Nepal an additional billion dollars to help it recover from the April 2015 Nepal earthquake.,Hindiin Neeppaal sochii lafaa bara 2015 ishee mudate irraa akka fooyyoftuuf akka ishee gargaruuf kennaa dabalataa doolara biliyoona tokkoo dhiyeessiteef
Mozambique announces it will reverse a rise in the price of bread that led to riots last week.,Moozambiki dabala gatii daabboo isa torban darbe jeequmsa kaase akka jijjiirtu beeksifte.
"“To be one of the best institutes in Africa, EEFRI needs legal procedure, active involvement of the people and the concerned bodies as well as capital and human resources,” he added.","""Giddugala akka Afirikaatti sadarkaa dursaa ta'uuf EEFRI'n hojimaata seera-qabeessi, dammaqinaan hirmaannaan uummataa fi qaamota xiyyefannoo kennan akkasumas kaappitaala fi humna namaa ni barbaada"" jechuun dabaleera."
"Sandstorm has hit the city of Dire Dawa, in the eastern part of Ethiopia and its surroundings.","Bubbeen cirrachaa magaalaa Dirre Dawaa, kutaa baha Itoopiyaa fi naannawaa isaa rukute."
"In his opening remarks, Israeli President Reuven Rivlin said that participants of both countries were aspiring to see a joint future to ensuring common concerns as food security, public health, infrastructure and energy.","Haasaa baniinsa isaa keessatti, Pirasdaantii Isiraa'el Reevin Rivliin hirmaattonni biyyoota lamaanii dhimmoota yaaddoo waliinii tahan akka wabii nyaataa, fayyaa hawaasaa, ijaarsaa fi annisaa mirkaneessuf fuuldura waliinii arguuf hawwii akka qaban dubbatan."
Prime Minister Abiy Ahmed called on Muslims to remember and practice the teachings of Prophet Muhammad while celebrating his birth.,Muummichi Ministeera Abiyyi Ahimed wayita ayyaana dhaloota isaa kabajanitti barsiisa Raajii Muhaammad akka yaadatanii fi hojiirra oolchan gaafatan.
The Children's Hospital of Philadelphia announces that 8-year old Zion Harvey became the first pediatric patient to receive a double hand transplant earlier this month.,"Hospitaalli Ijoollee Filaadelfiyaa, mucayyoon waggaa 8 Ziyoon Harveen dhukkubsattuu ijoollee jalqabaa dursa ji'a kanaa keessa harki lamaanuu nama biraa irraa dhaabateef ta'uu beeksise."
"BP announces it will plead guilty to charges of manslaughter and obstruction of Congress, and will pay a total of US$4.5 billion to the US Department of Justice and Securities and Exchange Commission.","BP'n himannaa nama qaluu fi Koongiresii danquun yakkamaa akka ta'e akka amanu, akkasumas Qajeelcha Haqaa fi Nageenyaa US fi Koomishinii Waljijjiirraaf waliigalatti biliyoona US$4.5 akka kanfalu beeksise."
"Ethiopia has done much in protecting biodiversity after the signing of the Rio Agreement in 1992, according to Ethiopian Biodiversity Institute.","Itoophiyaan baayoodaayiversitii kunuunsuuf erga walii galtee Riyoo 1992tti mallatteesiteen booda hojiilee hedduu hojjetteetti, akka Giddugala Baayoodaayiversitii Itoophiyaatti."
"Regular training for the health professionals is according to him, a basic assistance the ministry had gave to improve the efficiency treatment.","Akka inni jedhetti leenjiin idilee hojjetoota fayyaa, deggersa bu'uuraa ministirichi waldhaansa gahaa fooyyessuuf kenneedha."
The Gambia announces that they have submitted a lawsuit against Myanmar for their role in the Rohingya genocide at the International Court of Justice in The Hague.,Gaambiyaan himannaa Mayaanmaar duguuggaa sanyii Rohingyaa keessaa ga'ee qabdi jedhu Mana Murtii Haqaa Addunyaa kan Haguwe kessatti argamutti galfachuu beeksiste.
"Ephraim Mirvis is announced as the next Chief Rabbi of the United Kingdom, replacing Dr. Jonathan Sacks who will step down from the role in 2013.",Bara 2013'ttii aangoo irraa kan bu'an D.r Joonattaan Saaks bakka bu'uun Efireem Maarvis dursaa Rabbii Yunaayitid Kiingidam kan itti aanu ta'uun isaa labsame.
"According to him, amendment is made on Trade Law besides drafting investment proclamation to encourage the private sector.","Akka inni jedhutti, foyya'insi Seera Daldalaatti dabalee labsii investimentii sektara dhuunfaa jajjabbeessuuf qopheessuun godhameera."
Ethiopia and France signed a military cooperation accord in March 2019 during President Emmanuel Macron’s visit to Addis Ababa.,Itiyoophiyaa fi Faransaay waliita'iinsa humna waraanaa waqtii Pireezidaantii Emaanu'eel Maakiroon Addis Ababa daawwatanitti Bitootessa 2019 mallatteessan.
"Located in Mekanisa, it gives a different meaning to modernism and what we consider as modern.","Mekkaanisaatti kan argamu, ammayummaa fi ammayyaa jennee wanta fudhannuuf hiika biraa kenna."
Haiti will redo its presidential election after findings of widespread voter fraud in last years voting.,Haayitiin waliin dhahamuu sagalee bal'aa waggaa darbe erga bira geessee booda filannoo pirasdaantawaa ishee irra deebi'uufi.
"Design Week Addis Ababa (DWAA), a weeklong celebration of innovation and creativity, which was launched on January 14, will close today.","Dizaayin Wiik Addis Ababaa (DWAA), kabajni kalaqaa fi waa uumuu torbee guutuu Amajjii 14 jalqabe arra ni cufama."
A Ukrainian court sentences a former police chief Olexiy Pukach to life imprisonment for murdering journalist Georgiy Gongadze in 2000.,Manni murtii yuukireen yakka ajjeechaa ajajaan Poolisii duraanii Oleeksii Pukaach gazexeessaa joorj Goongadzee irratti bara 2000 Rawwateef hidha umurii guutuutiin adabe.
"The medical supplies are part of the project entitled “Improving the quality of health care provided to newborn babies in two zones of Tigray and SNNP regions, Ethiopia,” launched in March 2020.","Dhiyeessiin medikaalaa sun qaama pirojektii ""Qulqullina kunuunsa fayyaa ijoollee reefuu dhalataniif zooniiwwan lamaan naannolee Tigraay fi SNNP, Itoopiyaa keessatti kennamu fooyyesuu"" jedhamee waamamuu kan Bitootessa 2020 keessa eegalameeti."
"It was the latest in a long line of staggering performances in the game-changing technology, which is reckoned to improve performance by between half a second and a second a lap.","Tekinoloojiwwan tapha jijjiiroo keessatti raawwwii ajaa'ibsiisoo yerooo dhihoo asii kan ta'e, raawwii walakkaa sekoondii fi darba sekoondii gidduu jiruun ni foyyeessa jedhamee amanama."
"The Algerian government cuts food prices amid unrest, and vows to punish those responsible for rioting in recent days.","Mootummaan Aljeeriyaa jeequmsaan walqabatee gatii nyaataa ni hirrise, akkasumas warreen dhiyeenya kana jeequmsa kaasan akka adabu dhaadate."
The Tewodros Ashenafi Foundation was established by founder and CEO of SouthWest Holdings Ltd.,Faawundeeshiniin Tewodiros Ashennaafii hundeessaa fi CEO SawuthWeest Hooldingis Ltd dhaan hundeeffame.
"In this regard, the region will not only penalize companies but award gold, silver and bronze to the companies that respected the code of conduct and realize chemical and wastage usage as well as labor protection.","Dhimma kanaan, naannochi dhaabbilee adabuu qofa osoo hin taanee badhaasa warqee, birrii fi nahaasaa dhaabbilee danbii ittiin bulmaataa kabajan fi itti fayyadamaa keemikaalaa fi balfaa akkasumas kunuunsa hojjettotta humnaa hojirra oolchaniif ni kenna."
"Mahmoud Badr, the founder of the Tamarod grassroots movement that helped spark the July 2013 Egyptian protests, reportedly survives an assassination attempt.","Mahmuud Baadir, hundeessaan sochii hundee Tamaarood kan mormii Gibxii Adooleesa 2013 akka eegalamu gargaare, yaalii ajjeechaa irraa akka ooletu gabaasame."
The Space Shuttle Atlantis lifts off for the final mission of the US Space Shuttle program.,Xiyaarri hawaa Atiilaantis galma xumuraa sagantaa xiyaara hawaa Us'tif olbaateetti.
Federal Government Procurement and Property Administration Agency announced that it has finalized preparations to start electronics procurement system technology (e-GP).,Ejensiin Bulchiinsa Bittaa fi Qabeenyaa Mootummaa Federaalaa teekinooloojii sirna abbaa qabeenyummaa elektirooniksii (e-GP) jalqabuuf qophii akka xumure beeksise.
Poland publishes the transcript of flight data recorders from the fatal 2010 Polish Air Force Tu-154 crash which killed 96 officials and intellectuals on 10 April.,Poolaand barreeffama waraabduuwwan daataa balalii Humna Qilleensaa Poolaand Tu-154 isa bara 2010 kufee angawootaa fi beektota 96 gaafa Ebla 10 ajjeesee maxxansite.
"American singer Taylor Swift wins four trophies, including Artist of the Year, and holds 23 American Music Awards, beating Whitney Houston.","Weellistun lammii Ameerikaa Teyilar Iswiifti badhaasa weellistuu baricha dabalatee, geepha afur mootetti, akkasumas witnii hostan caaluudhaan badhaasa Ameerikaa kan ta'an 23 qabatte jirti."
"In addition to recommending holding the elections by taking the necessary precautions, the Ministry also suggested economic and social activities be restored with proper precautions taken to prevent the spread of the virus.","Of eeggannoo barbaachisaa gochuun, filannoon akka geggeeffamuun gorsa kennuun alatti, Ministirichi hojiileen diinagdee fi hawaasaas of eeggannoo dursaa barbaachisaa faffaca'iinsa vaayirichaa ittisu fudhachuun akka bakkatti deebi'us akeekeera."
The opposition movement in Venezuela seeks help from France.,Sochiin mormitootaa Venezuweellaa keessaa gargaarsa Faransaayi irraa barbaadan.
Seven-time Formula One drivers' champion Michael Schumacher is reported to be in critical condition after brain surgery in Grenoble for a head injury suffered while skiing in the French Alps.,"Shaampiyooniin yeroo torbaa konkolaachisaa Foormulaa Wanii, Mikaayel Iskumaachar miidhama sammuu inni utuu Gaarren Faransaayi keessa cabbiirra kaatuu isa mudateef yaalii baqaqsanii yaaluu sammuu Girenoobel keessatti isaaf godhame booda haala ulfaataa keessa akka jirutu gabaasame."
"Speaking on the meeting held on the draft Diaspora Policy in Addis Ababa, Diaspora Affairs Director General with the Ministry of Foreign Affairs, Faisel Aliyi said inputs obtained in the discussion processes were included in the draft.","Ministeera Haajaa Alaatti Daayirekterri Olaanaan Dhimma Diyaaspooraa, Fayisal Aliyyii, marii isa wixinee Qajeelfama Diyaasporaa irratti Addis Ababaa keessatti geggeeffame irratti dubbachuun, galteewwan adeemsa marichaa keessatti fudhataman wixinicha keessatti hammatamaniiru jedhe."
"Police in India charge five men with the murder of a 23-year-old woman who was gang-raped on a bus in Delhi on December 16, 2012.",Poolisoonni Indiyaa hagayya 16 bara 2012 New Deelii Baasii keessaatti dubartii umurii 23 taatee irratti namoota gudeeddii gurmuu erga raawwaataniin booda lubbuu ishee galaafatan shan irratti himanna bane.
The Argentine National Congress approves installation of a Chinese satellite tracking station in Patagonia.,Kongireessiiin Biyyaalessaa Arjentiinaa ijaarsa giddugala hordoftuu saatalaayitii Chaayinaa Patagoniyaa keessatti mirkaneessan.
"The Film Week hopes to bring African countries closer by showcasing each other’s works, forming a shared experience and creating opportunities for storytellers.","Torban Fiilmichaa hojii ofii wal walitti agarsiisuun, muuxannoo qoqqoodamuu uumuu fi kanneen seenaa himuu danda'aniif carraawwan uumuun biyyoota Afirikaa walitti butuuf abdii godhate."
Police in South London launch a murder hunt after a 15-year-old schoolboy is stabbed to death in the street.,Poolisoonnii kibba Landan sababa barataan umurii waggaa 15 daandii irratti cuubeen waraanamee ajjeeffamuu isaatiin walqabatee barbaacha yakkamaa ajjesee kanaa labsan.
Twenty one Ethiopian engineers got training in China and were involved in the design and development of the satellite.,Injiineroonni Itoopiyaa digdamii tokko tahan Chaayinaatti leenjii fudhatanii saxaxaa fi ijaarsa satalaayitichaa irratti hirmaataniiru.
"Noting partnerships engender reliable changes; President Rivlin said “the agreements inked today will set forth to the ever growing ties between the two countries in addressing challenges in health, education and energy in particular”.","Michummaa jijjirama amansiisaa fidaa jiru yaadachiisuun; Pirasdaant Riivlin ""Waliigalteen har'a godhame hidhata biyya lamaan gidduu rakkoowan fayyaa, barnootaa fi keessumaa ammoo annisaa furuuf hidhata guddaa jiru ka'a"" jedhe."
"Prime Minister Abiy Ahmed has handed over the national science, technology and innovation award to 194 winners today.","Muummeen Ministeeraa Abiyyi Ahimed badhaasa saayinsii, teekinoolojii fi kalaqaa har'a injifattoota 194'f kennan."
Ethiopian Environment and Forest Research Institute announced a plan to cover the Abay Gorge areas ranging from Kere Goha to Dejen town.,Inistitiyuutiin Qorannoo Eegumsa Naannoo fi Bosonaa Itoopiyaa naannoowwan Abbay Gorgee kan Kerre Gohaa fi magaalaa Dejen gahu uwwisuu karoorsuu beeksie.
"Africa’s first black woman to receive an Olympic gold medal, Derartu Tulu, has been elected to lead the Ethiopian athletics Federation on Thursday November 15, 2018.","Meedaliyaa warqee Olompikii fudhachuun dubartiin-gurraattin jalqabaa Afiriikaa, Daraartuun Tulluu federeeshinii Atileetiksii Itoophiyaa hogganuuf Kamisa Sadaasa 15, 2018 filatamte."
Haiti delays Carnival celebrations over concern that anti-government protests might turn violent.,Haayitiin yaaddoo mormiin faallaa mootummaa gara hookkaraatti cehuu mala jedhuun sirna kabaja Kaarnivaal achi butte.
"The solar eclipse was visible in several cities across Ethiopia, including the historical town of Lalibela and the capital Addis Ababa starting from 6:50 a.m to 9:30 a.m.",Golgaan sirna aduu kun magaalaa garagaraa guutummaa Itoophiyaa keessatti magaalaa seena qabeettii Lalibalaa fi magaalaa gudditti Addis Ababaa dabalatee sa'atii 6:50 a.m hanga 9:30tti ni argama ture.
"President of Nigeria Goodluck Jonathan announces a N3 billion fund to ""intervene"" in Nollywood.","Pirasdaantiin Naayijeeriyaa Guudlaak Joonaattaan Noolywuud keessatti ""intervene"" deggeruuf maallaqa biliyoona N3 beeksisan."
Substitute Ariet Odong made it 2-2 after the 78th minutes before the referee sent off Ethiopia’s coach Firew Hailegebral.,Jijjirraan kan seente Ariyeet Odoong daqiiqaa 78 booda abbaan murtii leenjisaa Itoophiaa Fireew Haayilegabreeliin gaggeessuun dura 2-2 goteetti.
"Since it began operation in 2017, the hospital has provided health services for 116, 029 patients, of which 25 percent are mental disabled persons, it was learned.","Erga bara 2017 keessa hojii eegalee, hospitaalichi tajaajila fayyaa dhukkubsatoota 116, 026 tahaniif kenneera, kanneen keessaa dhibbantaan 25 namoota qaama miidhamummaa sammuu qaban tahuun hubatameera."
"Israeli authorities approve 153 construction permits for settlement homes in East Jerusalem, and plan to approve another 11,000 in the coming months.","Aanga'oonni Isiraa'el Baha Iyyerusaalemitti eyyemoota ijaarsaalee manneen jireenyaatif oolanii 153 mirkaneesse, akkasumas ji'oota dhufanitti kanneen biroo 11,000 eyyemuuf ni karoorsa."
"Meanwhile, the officials will undergo medical and physical tests besides theoretical and practical sessions under the supervision of experienced CAF instructors.","Osoo kanaan jiru, aanga'oonni qoorannoo fayyaa fi qaamaa yeroo barnootaa yaadaa fi hojiin deeggarame kan lenjistoota CAF muxannoo qabaniin qajeelfamutti dabalee ni geggeessu."
Gun battle between security forces and Taliban fighters leave four militants including their commander dead in Wardak province 40 km west of Afghanistan capital Kabul.,Lolli dhukaasaa humnoota nageenyaa fi loltoota Taalibaan gidduu kutaa biyyaa Wardak kan magaalaa guddoo Afgaanistaan Kaabul irraa gara dhiyaatti 40 km fagaattu keessatti tahe hidhattoonni afur ajajaa isaanii dabalachuun akka ajjeefaman godhe.
"The Van Gogh Museum in Amsterdam identifies a new Vincent Van Gogh painting, Sunset at Montmajour.",Godambaan Van Goog Amisterdaam keessaa fakkii Vinsent Vaan Goog haaraa Saanset Montmaajor keessatti adda baase.
Researchers in New Zealand have discovered that the MeNZB vaccine for meningitis may protect against gonorrhea by 30%.,Qorattoonni Niwu Zilaand keessaa Talaalliin meninjaayitis MeNZB 30%'n gonooriyaa irraa eeguu akka danda'u bira gahan.
Malaysian police use tear gas and water cannon to disperse thousands of protesters gathered in Kuala Lumpur calling for free and fair elections.,Poolisiin Maleejiyaa mormitoota kumaan lakka'aman kan Ku'aalaa Luumpur keessatti filannoo haqaa fi bilisaa akka geggeeffamuuf gaafatan bittimsuuf gaaza imimmaanessuu fi kan bishaan humnaan facaasuu fayyadaman.
"French Culture Minister, Franck Riester said during the award giving ceremony that Mulatu has uplifted music to another level by combining Ethiopian and another melodies.","Yeroo qophii badhaasicha kennuu, Ministeerri Aadaa Faransaay, Firaank Reeyiste, Mulaatuun sagalee muuziqaa Itoopiyaa fi kan biraa walitti makuun muuziqaa gara gulantaa biraatti olkaaseera jedhe."
Match week eight of the Ethiopian Premier League (EPL) will feature across the country this weekend.,Torbee Taphaa saddetaffaan Piriimer Liigii Itoophiyaa(EPL) xumura torbanii kanatti guutuu biyyaatti ni geggeefama.
AIC Deputy Director-General Taye Girma told ENA that the center which aims to become a national center of excellence by establishing AI policy and creating conducive ecosystem for the private and public sector is facing two major challenges in general.,Itti aanaan Daayirekteera Olaanaa AIC Taayyee Girmaa giddugalichi dambiilee AI hundeessuunii fi sekteroota dhuunfaa fi hawaasaaf haala mijataa uumuun giddugala kabajamaa biyyaalessaa tahuufi kan kaayyeefate akka waliigalaatti rakkoolee gurguddaa lamatu isa mudachaa jira jedhe.
"The author in his book presents a traumatic and detailed account of the extent of the massacre, which resulted in the deaths of more than two thousand monks, priests, and local residents at the monastery.","Barreessichi kitaaba isaa keessatti kan nama sururuu fi ragaa gadi fagoo ajjeechaa jumlaa sanaa, kan du'a monokseewwan, lubootaa, fi jiraattota naannoo gadaamichaa kuma lamaa oliif sababa tahe dhiyeessa."
"A novel vaccine tested so far only on monkeys provided “completely short-term and partial long-term protection” from the deadly virus, researchers reported in the journal Nature Medicine.","Talaalliin haaraan haga ammaatti Jaldeessa qofa irratti kan yaalame ""guutummaatti yeroo gabaabaaf akkasumas eegumsa yeroo dheeraa gar-tokkee tahe"" vaayirisa hamaa irraa, qorattootatu gaazexaa Neechar Medissin irratti gabaase,"
"New data from the NASA space probe MESSENGER indicate that Mercury, the closest planet to the Sun, almost surely has water ice buried beneath the surface at its north pole.","Daataan haaraan qorannoo hawaa NASA, MESSENGER akka Merkuriin, pilaanetiin baayyee aduuttii dhiyaattu, dhugaamatti jechuun bifa danda'amuun gara poolii kaabaa isheetti cabbiin bishaanii dachii ishee jala awwaalamee akka jiru agarsiisa."
Ambassador Teshome and Vice Minister Liu Hua noted that the two countries need to give impetus to their relationship with multifaceted bilateral and multilateral engagements in the future.,Ambaassadar Tashoomee fi Itti aanaa Ministeerri Li'u Huhaan gara fulduraatti biyyoonni lamaan walitti dhufeenya isaaniitiif xiyyeeffannoo walitti dhufeenya gam-lamee fi gam-hedduu gam hedduun kennuu akka qaba qabsiisaniiru.
The United States and China agree to work together to reduce the use of hydrofluorocarbons which are thought to contribute significantly to global warming.,Yuunaayitid Isteetisii fi Chaayinaan itti fayyadama haayidroofiloorookaarbon kan caalmaan ho'a addunyaaf akka gumaachaa jirutti yaadamu hir'isuun waliin hojjechuuf waliigalan.
"According to a letter issued by Tsigereda Kifle, deputy director of EPHI, HIV Kits including First Response HIV 1-2.0, Uni-Gold HIV, VIKIA HIV-1/2, Beijing Wanta HIV-1/2 are said to be under evaluation.","Akka xalayaa Tsigeredaa Kifilee, itti aantuu daarikteeraa EPHI tiin qophaa'eetti, Deebii Jalqabaa HIV 1-2.0, Yuuni-Goold HIV, VIKIA HIV-1/2, Beejing Waantaa HIV-1/2 dabalatee Meeshaaleen HIV qorannoo jala akka jiran hiamame."
"Several Beirut port officials are placed under house arrest as an investigation starts into how 2,750 tons of ammonium nitrate was left unsecured at a warehouse at the port for six years.","Aangawoonni buufata doonii Beeruut muraasi akkamiin amooniyeem naayitireetiin tooniin 2,750 mankuusaa bakka buufata doonichaa keessatti waggaa ja'aaf utuu hin eegamin akka ture adda baasuuf akkuma qorannoon eegaleen hidhaa mana keessaa jala galan."
"In golf, Tiger Woods wins the inaugural Zozo Championship in Japan by three shots over Hideki Matsuyama for his 82nd career PGA Tour title, tying him with Sam Snead atop the all-time list.",gama tapha Goolfiin Taayiger Wuuds tapha baniinsaa Chaampiyeenshippii Zoozoo jappaan keessatti geggeeffama jiru irratti Hideekii Maatisiyaama qabxii sadiin dursuun injifate kunis seena dorgommii badhaasa PGA TOUR kan mataa isaa yeroo 82ffaaf dursaa galmee dorgommichaa yeroo maraa kan ta'e Saam Sneed waliin taphata.
"Violence between the Amhara and Gumuz ethnic groups left dozens of people dead last month in Amhara and its neighbouring region, Benishangul Gumuz.","Mummeen Ministeeraa Itoopiyaa Haayilee Maariyaam Dessaaleny hookkarichaaf ""humnoota faallaa nageenyaa"" ceepha'eera."
"North Korea threatens the ""final destruction"" of South Korea during a United Nations conference on disarmament.","Kooriyaan Kaabaa konfiraansii Mootummoota Gamtoomanii humna waraanaa hiikkachiisuu irratti ""diigamsa isa dhumaa"" Kooriyaa Kibbaa akeekkachiifte."
Six armored personnel carriers belonging to the Ukrainian military are captured by pro-Russian protesters amid rising tensions between the protestors and the military.,"Hiriira mormii deeggartoota Ruusiyaa yeroo ammaa mormitootaaf waraana mootummaa giduutti haalli jiru rakkisaa ta'aa dhufe kana keessatti, meshaaleen hidhannoo waraanaa qabeenyaa humna waraana Yuukireen ta'an ja'a hirmaattota hiriirichaatiin qabamaniiru ."
Lawmakers from Ukraine ratify a landmark agreement with the European Union in tandem with a meeting of the European Parliament.,Seera baastonni Yukireen walgahii paarlaamaa Awurooppa hordofuun waliigaltee seene qabeessa Gamtaa Awurooppaa waliin raggaasisan.
Eid al-Adha is the feast of obedience and sacrifice that remembers the willingness of Prophet Ibrahim to sacrifice his son Ibrahim based on a call from God (Allah).,Iid al-Adha dhangaa abboomamuu fi wareegamuu isa Raajiin Ibiraahim ilma isaa Ibraahimiin waamicha Waaqaa (Allaa) irratti hundaa'uun wareeguuf fedhii agarsiise yaadachuufi.
"A tropical storm watch is issued for Tropical Storm Don in the US state of Texas between Port Mansfield north to San Luis Pass. ,",Hordoffiin hobonboleettii tirooppikaalii US isteetii Teeksaas gidduu buufata doonii Mansifiildii kaaba gara Saan Luwiis Paas keessatti Hobonboleettii Tiroopikaalaa Doonii mudachuu maluuf akeekkachiisni godhame.
The story of the EPRDF-led developmental state is rather short; yet it is highly eventful.,"Seenaan guddina biyyaa EPRDF'n geggeeffamu gabaabaa tahuyyuu, taheewwan hedduu qaba."
Greece faces suspension or expulsion from the European Union's Schengen Area if it can not prevent waves of migrants from crossing over the country into Macedonia.,Giriik imala baqattoota biyyattii keessa darbuun gara Maqedooniyaa imalan hin dhaabdu taanaan Icheengen Eeriyaa Gamtaa Awurooppaa keessaa bahuun ykn ugguramuun ishee eeggata.
"City officials of Glendive, Montana declare that the tap water is safe to consume following the January 17 oil spill in the Yellowstone River.","Aangawoonni bulchiinsa magaalaa Gileendiiv ,moontana dhingalawuu boba'aa ji'a amajjii 17 laga Yeloowstoon keessattii qaqabeen booda bishaanni magaalichaa dhugatiif fayyaqabeessa labsan."
2020 Stanley Cup Finals The Tampa Bay Lightning win the Stanley Cup for the first time since 2004 following their game 6 victory against the Dallas Stars.,"Goolabdoonni Geeba Istaanlii bara 2020, Ze Taampaa Beey Laayitiniing tapha isaanii Daalas Istaars wajjin morkatan si'a 6 mo'ichuu hordofuun erga bara 2004 tii yeroo jalqabaaf Geeba Istaanlii injifatan"
The Great Ethiopian Run was launched in 2001 by the initiative of the athletics icon Haile Gebreselassie and so far it has held 17 streets runs in Addis Ababa and other towns.,Figichi Guddaan Itoophiyaa kaka'umsa fakkeenya atileetiksii Hayilee Gabrasillaaseetin bara 2001 eegale akkasumas hanga ammaatti figichi daandii irraa 17 Finfinnaa fi magaalota biraatti geggeefameera.
Ethiopia and Djibouti have established a Joint Coordinating Committee in Djibouti to expedite the successful implementation of the plantation of nine million tree seedlings In Djibouti.,Itoopiyaa fi Jibuutiin Jibuutii keessatti dhaabbii biqiltuuwwan milioona sagalii ariitiin milkeessuuf Koree Qindeessii Waliinii Jibuutii keesatti hundeessan.
"An outbreak of Legionellosis (Legionnaires' disease) in Quebec City, Canada, kills 8 people and infects 104.","Weerarri Legiyooneloosis (dhibee Leegiyooners) Kiyuubek Siitii, Kanaadaa keessatti namoota 8 ajjeesee 104 dhukkubsachiise"
Egyptian archaeologists discover the largest tomb yet discovered in the ancient Saqqara necropolis.,Arkiyoolojistoonni Gibxii `bakka awaalchaa durii Saqqaaraa keessatti awwaalcha haga ammaatti argamee keessaa isa guddicha argatan.
A new outbreak of the Ebola virus disease kills at least 17 people in the Democratic Republic of the Congo.,Weerarri dhukkuba vaayirasii Iboolaa haaraan Rippaanilika Diimokiraatawaa Koongoo keessatti yoo xiqqaate namoota 17 ajjeese.
A ceremony is held at the former site of Germany’s Buchenwald concentration camp to remember people imprisoned there because they were thought to be gay.,Bakka mana hidhaa duraanii Jarman Buchenwaald'tti dhiirota fedhii dhiira waliin walquunamtii saalaa gochuu qaban jechuun shakkamanii achitti hidhaman yaadachuuf qophiin godhame.
"The Ukraine Parliament confirms all government candidates, including that of foreign minister, appointed the previous day by President Petro Poroshenko.",Paarlaamaan Yukiriyeen ministeera haajaa alaa dabalachuun kaadhimamtoonni mootummaa hunda guyyaa darbe Pirasdaantii Peetiroo Proshenkoon muudaman mirkaneesse.
