en,om
Doctors Without Borders alleges the World Health Organisation is rationing vaccines for Ebola in the Democratic Republic of the Congo despite adequate resources.,"Dooktors Wizaawut Boorders, Dhaabbanni Fayyaa Addunyaa utuu galteen gahaan jiruu dhiyeessii talaallii Iboolaa Rippabilika Diimokiraatikii Koongoo keessatti daangesse jechuun himate."
"Ukrainian forces say they managed to stop a larger part of a convoy of around 50 armoured vehicles, which entered Ukraine from the border with Russia near Novoazovsk.",Humnoonni Yukireen gara caalaa garee konkolaattota waraanaa 50 kanneen kara Raashiyaa wajjin waldaangessa naannoo Noovoozoviskiin Yukireeniin seenan dhaabuu akka danda'an dubbatan.
"Astronomers discover 139 new ""minor planets"" in the Solar System that are beyond the orbit of Neptune, which helps boost odds of finding Planet Nine.","Qorattoonni hawwaa ""pilaanetoota xixiqqoo"" haaraa 139 kan orbitii Neeptiyuun ol ta'an, kan barbaacha Pilaanetii Sagalii dhibaa ta'e fooyyessuuf gargaaran, Sirna Soolaarii keessatti argatan."
"In rugby league, the New Zealand Warriors are fined AU$15,000 for Russell Packer urinating on the field before a game.","Liigii Rabgii keessatti, Ruusel Paaker tapha dura dirree keessatti waan fincaa'eef Ze Niwuuzlaandi Waariyeers AU$15,000 adabaman."
Factories causing environmental pollution in Oromia Regional State were urged to promptly mend their ways and operate as per the set standards.,Warshaalee bulchiinsa naannoo Oromiyaa keessatti faalama naannoo fidaa jiran hatattamaan maloota hojii isaanii akka sirreessanii fi akka seera ka'ametti akka hojjetan gaafataman.
The government of Guyana reports that pirates attacked fishermen off the coast of neighboring Suriname.,Mootummaan Guyyaanaa saamtonni galaana irraa naannoo ollaa Surineemitti namoota qurxummii qaban akka haleelan gabaase.
Mountaineers led by Tim Mosedale confirm suspicions that Mount Everest's famous Hillary Step had completely collapsed.,Garee gaara yaabdota' Tiim Mosediin durfamu Oduun kutaa beekamaan gaaraa Everest hilaarii jedhamuun beekamu jigeera jedhamee shakkamaa ture dhugaa ta'uu mirkaneessan.
"The Ethiopian Minster of Health, Dr. Kesetebirhan Admasu has been nominated by the co-chair of the Bill and Melinda Gates foundation, Mrs. Melinda Gates for the 120 under 40 awards.","Ministeerri Fayyaa Itoopiyaa, Dr. Kessetebirhaan Admaasuu badhaasota 120 40 gadiif dura teessu lammaffaa fawundeeshinii Biilii fi Melindaa Geetisii, Aadde. Melindaa Geetisi n filatame."
Four people are killed and around 40 injured after a passenger plane explodes in Surgut in eastern Russia.,Baha Ruusiyaatti kan argamtu Saargat keessatti balaa dhoohinsa xiyyaaraa imaltootaa irratti mudateen lubbuun namoota 4 yoo darbu namoonni 40 dhiyaatan miidhamaniiru.
"During my young age, I had a chance to watch these competitions and in 2004, I competed in the Addis Ababa club championships.","Ijoolummmaa kootti, carraa dorgommiilee kana daawwachuu argadheen ture fi 2004tti, shaampiyoonaa garee Finfinnee irratti dorgomeen jira."
"Lewis Hamilton wins a third World Drivers' Championship in Formula One, as his team Mercedes secures the Constructors' Championship.","Liwiis Haamiltan Foormulaa Wanii irratti Dorgommii Konkolaachistoota Addunyaa sadaffaa mo'ate, gareen isaa Meerseedis Shaampiyoonaa Konistiraaktar injifachuudhaan."
The African Diaspora Maritime Corp. withdraws from the America's Cup amid controversy over being denied an opportunity to be the American defender in the competition based on ethnicity.,Koorpiin humna galaanarraa Dayaaspooraa Afiriikaa waldhabdee carraa ittisaa Ameerikaa dorgommicha keessatti ta'uu sababa sanyiitiin dhorkamuurraan kan ka'e dorgomii Geepha Ameerikaa keessaa of baase.
Asian-Pacific Film Festival kicked off this week to a devoted audience eager to experience foreign films.,Festivaalli Fiilmii Eeshiyaa-Paasifik torban kana keessa dhaggeeffatoota kutatoo fiilmiiwwan biyya alaa ilaaluuf qophaa'anii jiraniif nii eegalama.
"In Betking Ethiopia Premier League match, happened in Hawasa, the champions Fasil Kenema beat Hadiya Hosaena 3 to 1.","Tapha Pirimeer Liigii Itoophiyaa Betkiing Hawaasaatti ta'etti, shaampiyoononni Faasil Hadiyyaa Hosaanaa 3 fi 1'n injifatan."
"As the country’s total debt surpassed 50 billion dollars since 2017, the country has become among the most indebted economies in Africa.","Haaluma liqiin walii galaa biyyatti doolara biliyoona 50 2017'n as darbeen, biyyattin Afirikaa keessatti diindageewwan liiqaan liqimfamn keessaa tokko taateetti."
The Authority urged the public not to use “Herbal Colgate” as well as inform the concerned offices in case they notice the products being sold.,"Abbaan taayitichaa ummati ""Heerbaal Koolget"" akka hin fayyadamne akkasumas oomishichi utuu gurguramuu yoo argan waajjira dhimmi isaa ilaallatu akka beeksisan yaadachiise."
"In golf, Tiger Woods is named as the PGA Tour's Player of the Year for a record 11th time.","Goolfii keessatti, Taayiger Wuudd, yeroo seena qabeessa 11ffaaf Taphataa Marsaa PGA Waggichaa jedhame."
"Leza, the organizer of the event, also paid tribute to prominent singer Zeritu Getahun who had passed away the previous day.","Lezaa, qindeessaan qophichaa, weellisaa Zerituu Geetahun kan guyyaa achi aanu du'aan dabarteef kabaja kennees ture."
"COVID-19 pandemic in the United States COVID-19 pandemic in New Jersey Governor Phil Murphy announces that their beaches will reopen for Memorial Day, but with restrictions.",Weerara COVID-19 Yuunaayitid Isteetis keessaa: Weerara COVID-19 Niwu Jeersii: Bulchaan Fiil Murfii iddooleen bashannanaa qarqara galaanaa Guyyaa Yaadannoof daangeffamoota waliin deebisamee akka banamu beeksisan.
"Environment Commission Director with the Commission, Bayu Tola, the two factorie–Hansen Glass Factory and Dire leather factors got closed after they repeatedly failed to warnings to make corrections.","Daarikteerri Komiishinii Eegumsa naannoo Komiishiniii, Baayyuu Tolaa wajjin warshaalee lamaan - Warshaa Burcuqqoo Hansenii fi warshaalee gogaa Dirree erga irra deebiin akeekkachisa akka sirreessaniif kenname guutu dadhabanii booda kan cufame."
"On the one hand, the song “Ethiopia” was criticized for preaching the grand narrative of Ethiopian nationalism without deconstructing the historical injustice, thereby denying the existence of oppression.","Karaa biraan, faaruun isaa ""Itoopiyaa"" jedhu seenessa guddaa sabboonummaa biyaalessaa Itoopiyaa utuu haqa seenaa hin muffin labsuun, jiraaachuu cunqurfamuu gane jedhamee qeeqamaa tureera."
The recommendations were implemented especially corrective vaccination campaigns against tetanus in 2016.,Gorsaaleen sun hojiirra oolfamiiru keessumaa duulawwa talaallii sirreeffamaa titaanasii irratti bara 2016.
France's National Front leader Marine Le Pen is under investigation for alleged misuse of European Union funding.,Geggessaan adda dureen biyyaalessaa Firansaay Maariin Lii Peen gargaarsa Gamtaa Awurroppaa irraa keenname qisaasessuudhaan shakkamuun qorannoon irratti geggeeffamaa jira.
The People's Republic of China releases 10 South African tourists held for allegedly distributing terrorist material.,Rippaabiliki Ummataa Chaayinaa Tuuristoota Afirikaa Kibbaa 10 kan meeshaalee shororkeessummaa raabsitu jechuun himatte gadi lakkisfte.
"Cheaper new meningitis vaccinations reduce cases in Africa, with Burkina Faso, Mali and Niger recording the lowest number of cases.","Talaallii haaraan dhibee morma qoorsaa gatiin salphaa ta'e Afiriikaa keessatti Burkiinaa Faasoo, Maalii fi Niijer lakkofsa namoota dhibeechan qabaman gadaanaa qabaachuun baay'ina namoota qabamanii gadi buuse."
"Oromia Environment, Forest and Climate Change Authority Deputy Director-General, Bona Yadessa said the authority will take corrective measures against the companies in the region which failed to implement the federal requirements.","Itti aanaa Daayirektara-Olaanaa Abbaa Taayitaa Naannoo, Bosonaa fi Jijjirama Qilleensaa Oromiyaa Boonaa Yaaddessaa abbaan taayitichaa dhaabbilee ulaagaa federaalaa hin eegne irratti tarkaanfii sirreeffamaa akka fudhatu himan."
"It covers 61 health centers, 229 health posts, and six primary hospitals in the two regions.","Buufataalee fayyaa 61, kellaa fayyaa 229, fi hospitaala jalqabaa ja'a naannoolee lamaan keessaa uwwisa,"
"As part of the agreement, Nokia will work with the two universities to provide tailored training and coaching programs and share the latest technical and business practices in the ICT sector in line with global developments and market demands.","Akka waliigaltichaatti, Nookiyaan Yuunivarsiitii lamaan wajjin leenjii mijataa fi sagantaalee leenjisuu ni kenna akkasumas sektera ICT keessatti barteewwan teekinikaa fi biizinisee dhiyeenyaa kan guddina addunyaa fi fedhii gabaa wajjin walsimatu nii qooda."
"The working group will also produce a case study report that lay out the business for targeting the film industry as a job creation sector, she indicated.","Gareen hojii sun gabaasa qorannoo taatee biizinesii kan industirii fiilmii akka sektara hojii uummaatti xiyyeeffatu akka qopheessu, isheen akeekte."
"This will foster healthy and growing advertising markets, which will result in a greater variety of content, and more localised content.”","Kun beeksisa gabaa nagaa qabuu fi guddachaa jiru, kan qabiyyeewwan garagaraa baayyee, fi qabiyyee naannoo caalmaa qabu ni guddisa,"
The 122th Adwa Victory was commemorated yesterday at National Theatre with different programs that attracted officials and veteran patriots.,Injifannoon Aduwaa 122ffaan kaleessa Tiyaatira Biyyaaleessaa keessatti sagantaalee garagaraa kan aangawootaa fi namoota jaalala biyyaa qaban sooruma bahan hawwachuun kabajame.
Rescuers from New Zealand and McMurdo Station looking for three Canadians aboard an airplane presumed to have gone down in Antarctica were grappling with bad weather conditions.,Lubbuu baraartonni Niw Zilaand fi Bufata MaakMurdoo irraa lammiiwwan Kanaadaa sadan xiyyaara Antarkaatikaa keessatti kufeen imalanii turan barbaadan haala qilleensaa hamaa wajjin wallaansoo walqabaa turan.
"On December 11, 2019 many media outlets were busy reporting about the Ethiopian goal prodigy.","Mudde 11, 2019 irratti tamsaasni midiyaa hedduun galmeessuu manii Itoophiyaa gabaasaa turan."
"The main materials being procured internationally, according to Soleyana, are voter registration book (voter list books), voter cards book, and plastic boxes with seals, to be used in the transport of materials to a secured storage facility at polling stations for overnight stays, voter registration forms, and voter registration stationary kits.","Akka Sooliyaanaan jettetti barruuleen ijoon akka addunyaatti bitamaa jiru, barruu galmee filattootaa (barrruuwan tarree filattootaa), barruu kaardiiwwan filattootaa, fi saanduqota pilaastikaa cufaawwan isaanii wajjin, kan geejiba barruulee sana gara buufata filannoo turtii halkaniif iddoo nageenya qabuutti ittiin geessan, gucawwan galmee filattootaa, fi wantoota barreeffamaa galmee filattootaf fayyadu dha."
"Zimbabwean politician Roy Bennett is killed in a helicopter crash near Raton, New Mexico, United States.","Namni siyaasaa Zimbaabuwee Rooyi Beneet balaa kufaatiin caccabuu heelikoptera yunaaytid isteetis,new meeksiikoo nannawaa Raaton keessattii isa qaqqabeen lubbuun isaa darbe."
Germany and the Netherlands suspend military training mission in Iraq citing escalating tensions in the region with Iran.,Jermanii fi Neezerlaand ergama shaakala waraanaa Iraaq keessaa olka'uu waldhabdee naannichaa Iraan waliin jiru sababeeffachuun adda kutan.
"Following the resignation of my former instructor in 2008, I took a responsibility to manage Choi Hong Hi taekwondo club and since then, I have been working as an instructor.","erga 2008 leenjisaa duraanii hojii gadi lakkisanii Ergasii as garee Teekwaandoo chooy Hoong Hi hoogganuuf itti gaafatamummaa fudhadheera, akka leenjisaatti hojjechaan jira."
"In his remarks after the signing agreement, Japanese Ambassador to Ethiopia Shinichi Saida commended the current geopolitical trends towards peaceful power transition taking shape in Africa.","Waliigaltee mallatteessuun booda, Itoophiyaattii Ambasaaddarri Jaappaan Shinichi Sayidaa taatee ji'oopolotiksii yeroo ammaa kan walharkaa fuudhamiinsa aangoo naga qabeessa Afrikaa keessatti bifa godhataa dhufe jajaniiru."
The Assad regime grants nationality to thousands of Kurds in al-Hasaka in a bid to appease protesters.,Bulchiinsi Asaad mormitoota tasgabbeessuf al Hasaakaatti kurdoota kumaan lakkaawamaniif lammummaa kenneera.
The United States Centers for Disease Control and Prevention is investigating 14 cases where the Zika virus may have been sexually transmitted.,Giddugalli Ittisaa fi To'annoo Dhibee Yunaayitid Isteetis namoota dhibeen qabaman 14 bakka vaayirasiin Zikkaa karaa quunnamtii saalaatiin daddarbuu hin oolletti qorachaa jira.
"At the conference, Trade and Industry State Minister Teka Gebreyesus said Ethiopia and China have good historical foundation to bring the current industrial cooperation into higher level.","Konfiransicha irratti, Ministeerri Ministeera Industirii fi Daldalaa Takkaa Gabreyesuus walta'iinsa industirii yeroo amma kana gara sadarkaa olaanaatti fiduuf Itoophiyaa fi Chaayinaan walitti dhufeenya seenaa gaarii qabu jedhaniiru."
The Great Ethiopian Run scheduled to take place for the first time outside Africa is also the 1st edition in the US.,Figichi Guddichi Itoophiyaa yeroo jalqabaatiif Afiriikaa alatti tasifamuuf beellamame akkasumas Ameerikaa keessatti marsaa jalqabaati.
"Ethiopian-Israel golfer Asher Iso, without taking anything away from the extraordinary achievements of the other winners this week, has championed Israel Men’s Masters Tournament at the Caesarea Golf Club.","Taphataa Goolfii lammii Itoophiyaa fi Isiraa'el Asher Isoo, osoo milkaa'ina aja'ibsiisaa mo'attoota biroo irra hin fudhatiin torbe kana dorgommii maasterii dhiiraa Isiraa'elif kilabii Goolfii Qisaariyaatti shaampiyoona ta'eera."
The Islamist terrorist group Boko Haram claims responsibility for a series of bomb and gun attacks in the north-eastern Nigerian town of Damaturu that have killed at least 63 people.,"Gareen shororkeessaa Bookoo Haaraam dhohinsa bombii fi haleellaa dhukaasaa walitti fufaa magaalaa kaaba-baha Naayijeeriyaatti argamtu Damaaturuutti ta'e, kan yoo xiqqaate namoota 63 ajjeessef itti gaafatamummaa fudhate."
"China Ecology and Environment Vice Minister, Liu Hua commended Chinese and Ethiopian professionals for doing their level best to see the satellite project succeed and meet its objectives.","Itti aanaan Ministeera Sirna Naanoo fi Naannoo, Li'uu Huhaan ogeessota Chaayinaa fi Itoophiyaa hojii gaarii piroojektiin saatalayitii milkaa'ee fi kaayyoo isa galmaan ga'ee arguuf gumaachaniif galata galchan."
"“In Africa we are one, to show unity in diversity; we may have different borders like Ethiopia, Nigeria, Egypt, and Central Africa Republic but Africa is one.","""Afirikaa keessatti nuti tokko, adda addummaa keessatti tokkummaa agarsiisuuf; daangaa adda addaa akka Itoopiyaa,Naayijeeriyaa, Gibxii, fi Rippaabilikii Giddugaleessa Afirikaa qabaachuu dandeenya garuu nuti Afrikaa tokkodha."
"With thousands of fans expected to show, the debutants in this year’s competition face a stern test in overturning the score and keeping a clean-sheet.","Deggartootni kumaan lakkaa'aman akka argaman kan eegamu, gareewwan gara liigiitti barana dabalaman qabxii fi tapha goolii irratti hin lakka'amne argachuuf qormaatatu isaan mudata."
"Molecular testing machines inaugurated in the premises of St. Paul Medical Millennium Medical College and Ethiopian Public Health Institute are said to have a capacity of testing a total of 4,500 samples of TB, Hepatitis B, Hepatitis C, cervical cancer, various sexually transmitted diseases, and other cases in 24 hours.","Maashinoonni qorannoo molikiwuulii Kolleejjii Miliniyemii Medikaalaa Qulqulluu Phaawuloos fi Inistitiyuutii Fayyaa Hawaasaa Itoopiyaa keessatti eebbifaman sa'atii 24 keessatti sumuda TB, Hepatetas B, Hepatetas C, Kaanseri gadameessaa, dhukkuboota walquunnamtii saalaan daddarban garagraa fi dhibeewwan biroo waliigalaa 4,500 qorachuuf dandeettii akka qabu himame."
"The policy direction geared toward prevention has also been successful in engaging the public at large, said Yibeltal.","Kallattiin tarsiimoo gara ittisaatti xiyyeeffate bal'inaan hawaasa qaqqabuuttis akka milkaa'e, Yibelxaal dubbateera."
"Irrecha, a thanksgiving festival of the Oromo people, has been celebrated at Hora Finfine in Addis Ababa today.","Irreechi, ayyaanni galata galfannaa ummata Oromoo, Hora Finfinnee Addis Ababaa keessatti harra kabajame."
"Ethiopian Health Minister Dr. Lia Tadesse has met with the United States Centers for Disease Control and Prevention (US-CDC) Ethiopia’s new country director, Dr. Caroline Rayan.","Ministeerri Fayyaa Itoopiyaa Dr. Liyaa Taaddesee daayirekteera biyyaa Giddugala Ittisaa fi To'annoo Dhibee Yuunaayitid Isteetis (US-CDC) Itoopiyaa haaraa, Dr Kaaroliine Raayaan wajjin mari'atte."
Tokyo Electric Power Co. resumes its policy of rolling electricity blackouts following ongoing problems caused by the 2011 Tōhoku earthquake and tsunami.,"Dhaabbanni Humna Elektirikii Tookiyoo rakkoo walitti fufaa sochii lafaa fi sunaamii Tohokuu bara 2011'n mudate hordofuun, qajeelfama isaa adda cituu elektirikii akka itti fufu eegale."
The National Council endorsed the nomination of the executive committee the president presented at the same meeting,Manni maree biyyoollessaas kaadhima koree hojii-raawwachistootaa pireezidantiin dhiyeessaniif walga'ii wal fakkaataa irratti fudhatamummaa keenanniru.
"EREC’s deputy project manager, Cai Qinhao, said his company is working to accomplish the project on schedule.","Itti aanaan hoogganaa pirojektii EREC, Chaayi Qinhaa'oon, kampaaniin isaa pirojekticha haala karoorfameen xumuruuf hojjetaa jira jedhe."
"This year’s edition of the Great Ethiopian Run has seen participation of more than 44,000 runners; and the event has grown to become a major street festival attracting more and more locals and tourists, every year.","Figichi guddaan Itoophiyaa marsaa bara kanaa hirmaattota 44,000 ol argateera; dabalees sagantichi agarsiisa karaa irraa guddaa jiraattota naannoo fi tuuristoota dabalee dabalee harkisaa jiru wagga gara waggaatti ta'aa jira."
"24-year-old Italian motorcycle racer Marco Simoncelli dies after crashing and being hit by two other riders at the Malaysian MotoGP, leading to the cancellation of the race. ,","Dorgomaan dokdokkee lammii Xaaliyaanii ganna 24, Maarkoo Simonsellii MootooJiiPii Maleejiyaatti erga kufee dokdokkee ooftota lamaan rukutamee booda du'e, kunis gara dorgommicha haquutti geesse."
An Egyptian protester removes the flag from the Israeli embassy as thousands protest outside following the death of five policemen near the border.,"Akkuma namoonni kumaan lakka'aman du'a poolisiiwwan shananii naannoo daaangaatti tahe alatti mormaniin, kan mormiitti hirmaate lammiin Gibxii tokko alaabicha imbasii Isiraa'el keessaa baase."
The World Health Organization says the novel coronavirus that originated from Saudi Arabia is not highly contagious.,Dhaabbanni Fayyaa Addunyaa vaayirasiin koronaa inni Sa'udii Arabiyaa keessaa ka'e baayyee kan daddarbu akka hin taane ibse.
"Information Communication Technology Sector Director-General at the ministry, Abiyot Sinamo told ENA that the national strategy designed to digitalize key public services has been well underway and being implemented as per the plan.","Ministeerichatti Daayirekterri Olaanaan Sektera Odeeffannoo Quunnamtii Teekinoolojii, Abiyot Sinaamoo tajaajiloota hawaasaa murteesoo tahan gara digitaalaatti jijjiiruuf tarsiimoon biyyaalessaa saxaxame hojiirra akka jiruu fi akka karoorichaatti hojiirra oolaa akka jiru ENA'tti dubbate."
"Six delegates representing Ethiopia have finalized preparations to partake in the Cannes film festival including model and actress, Gelila Bekele as well as Film producer Mehret Mandefro.","Moodelii fi taatuu, Geliilaa Baqqalee akkasumas qopheessituu Fiilmii Mihret Mandefroo dabalachuun, jilli nama ja'aa Itoopiyaa bakka bu'an Festivaala Fiilmii Kaannes irratti hirmaachuuf qophii xumuraniiru."
"All pluses and other commodities which are trading through the Ethiopian Commodity Exchange (ECX) are set to be mandatory starting from this Ethiopian budget year, according to the authority.","Qabeenyonni hundi fi meeshaalee biroon karaa Daldala Oomishaa Itoohiyaa (DOI) daldalaman bara baajataa kanaa qabee dirqama ni ta'u, akka abbaa taayitichaatti."
The institute has been diversifying efforts to improve the ecological system and conserving biodiversity during the period.,Giddugalichi yeroo kanatti sirna naannoo foyyeessuu fi baayoodaayiversitii eeguu irratti hojiiwwan garagaraa hojjechaa ture.
"Researchers describe the recently rediscovered Hula painted frog, long thought to be extinct, as a ""living fossil"".","Qorattoonni fatteewwan Hula dibamtee jirtu kan dhiyeenya irra deebiin argamte, kan dura raawwattee baddeetti jedhamee yaadame, akka ""foosilii jiraattuutti"" ibsan."
East African countries have made sustained efforts to take advantage of their AGOA eligibility in recent years.,Biyyoonni baha Afiriikaa waggoota dhiyoo keessatti itti fayadamummaa AGOA fayyadamuuf carraaqaniiru.
"The corpses of 53 pro-Muammar Gaddafi fighters are found in Sirte, all having apparently been summarily executed by NTC troops.","Reeffi loltoota Mu'aammar Gaadaafii deggeran 53 sirteetti argameera, gabaabumatti walitti qabaan hunduu loltoota NTC'tin ajjeefaman"
EEFRI Director-General Abiyot Berhanu said the institute has been collecting tree seeds to recover deforested lands.,Daayirekteerri-Olaanaan EEFRI Abiyoot Birihaanuu giddugalichi ija mukaa lafa bosonni irra badee haromsuuf funaanaa akka jiru himan.
A runner who fled Ethiopia nearly a decade ago is preparing for Sunday's Tokyo Marathon with hopes of returning to Japan this summer as a member of the Refugee Olympic Team.,fiigaan waggoota kudhan dura Itiyoophiyaa kessa baqate maaraatoonii Tookiyoo Dilbata dhufuutiif qophaa'aa jira kanaan abdii akka akka miseensa Garee Olompikii Baqattootti Jaappaanitti deebi'uutiin .
This monthly Paugmé Shir-shir event usually involves two days spent venturing off into the surrounding hillsides for various outdoor adventures and one night spent camping under the stars.,Qophiin Shirr-shirriin Paagumee ji'a kanaa bashannana adda addaaf tulluuwwan naannoo jiran jala guyyaa lamaaf deemaa akkasumas guyyaa tokko urjiiwwan jala dunkaana keessa bulama.
"The country is importing daily the same amount of fuel as it was in the past days via Djibouti and Sudan with more than 300 fuel trucks, he said.","Biyyattin guyyuu hammeentaa boba'aa wal fakkaataa guyyoota darban keessatti karaa Jibuutii fi Sudaan'tiin konkolaataa boba'aa 300 oliin gara biyya keessatti galchaa jirti, jechuun dabaleera."
The state minister noted that the evaluation process deals with issuance of certification for first degree graduates who pass the required examinations and get qualified for standards put in place to improve the service delivery.,Deetaan Ministeerichaa adeemsi madaallii eebbifamtoota digiri jalqabaa warra qorumsa barbaachisu darbeef waraqaa ragaa kennuun dhiyeessii tajaajilaa fooyyeessuuf standardii ka'amee guutuu akka tahe dubbate.
Dr Dereje underscored the need to identify strengths and weakness observed in the past and find ways to deal with them to eliminate the disease by 2030.,Dr Darajjee dhukkubicha bara 2030 tti balleessuuf yeroo darbe keessatti jabinootaa fi laaffinoota argaman adda baasuun karaa ittiin isaan furan barbaaduun barbaachisaa akka tahe dubbatan.
A vaccine for the ebola virus is discovered to be 99.78%–99.87% effective.,Talaalliin vaayirasii iboolaa 99.78%–99.87% bu'aa qabeessa akka tahe bira gahame.
The party has urged the young generation to understand the reasons behind the party’s armed struggle and ensure the already started journey of the country towards renaissance.,"Ayyaannii hundeeffama Adda Bilisa Baasaa Ummata Tigraay (TPLF) 41ffaan Maqalee keessatti yaadannoo wareegamtootaa, marii paanaalii fi sagantaalee biraan kabajame."
NASCAR becomes the first major American sports league to resume its season since the start of the COVID-19 pandemic in the United States.,NASCAR Yunaaytid Isteetis keessatti erga weerarri covid 19 eegale as dorgomii waktii jalqabuun Ispoortii liigii olaanoo Ameerikaa keessa isa dura isa taasisa
"Over 71,000 livestock have already died since the drought began.","Erga hongichi jalqabee kaasaa beeyladoonni 71,000 ol tahan du'aniiru."
"Rochus Misch, the last witness to Adolf Hitler’s suicide in the Führerbunker dies at the age of 96.","Roochus Miisch, ragaan dhumaa of ajjeesuu Adoolf Hiitilar Fuhreerbanker keessattii umrii 96tti du'e."
"Manufactured by Tomizawa & Co. Ltd, a small Japanese company, AdPower is a unique technology developed twenty years ago, Toru Tomizawa, President, told The Reporter on Thursday, while briefing reporters about the product.","Korporeeshinii Tomizaawaa & kan oomishame, kaampaanii xiqqaa Japan kan ta'e, AdPowerin tekinooloojii addaa waggaa digdama dura kalaqameedha, Toru Tamizawa, Pireezidaantii, Kamisa Ripporterichatti osoo waa omishichi ripporterootaaf ibsanii himaniiru."
U.S. President Barack Obama lifts a trade embargo of communications equipment and software to non-government Iranians.,Pirasdaantiin Yuunaayitid Isteetis Baaraak Obaamaan qoqqobbii daldalaa meeshaa koomunikeeshinii fi sooftiwerii Lammiiwwan Iraan qaama mootummaa hin taanee irraa kaase.
The Supreme Constitutional Court of Egypt rules that the country's Islamist dominated Parliament and Constituent Assembly of Egypt were illegally elected.,Manni Murtii Heeraa Olaanaan Gibxii Paarlaamaanii fi Walitti-qabamni naannoolee Gibxii kan hordoftoota amantii Isilaamaan dhuunfatame karaa seeraan alaa akka filatame murteesse.
